Review,Topics,Positive,Neutral,Negative,Token Predictions Corrected
"Boa comida, boa música, onde todos os frequentadores acabam se divertindo muito e um atendimento bom para os tempos atuais.",2,0.9693046808242798,0.015460068359971046,0.015235303901135921,[]
"Comida maravilhosa, ambiente legal animado e com musica, otimo programa para o fim de semana com os amigos!! Recomendo os tacos!!",2,0.982344388961792,0.008190872147679329,0.009464716538786888,[]
"O ambiente é agradável e a comida boa, mas o que realmente chama a atenção é a energia do local, todos muito bem humorados. Os músicos e os tequileiros são um diferencial.",2,0.9053810238838196,0.044850949198007584,0.04976794123649597,[]
"Fui no dia 20/07 com uma amiga
Clima descontraído e com uma boa receptividade por parte dos funcionários
Couvert de R$ 12 por pessoa, sendo que eles cantam pelo menos uma música por mesa
Comida muito boa e um pouco apimentada como deve ser em...Mais",2,0.6754693388938904,0.1068841740489006,0.2176464945077896,"[('Couvert', 'I-ORG')]"
"Lugar super animado, comida gostosa, excelente para levar os amigos!  Músicas alegres, decoração impecável!",2,0.9892705678939819,0.007566545158624649,0.0031628513243049383,[]
"Já estive no restaurabte do jardim botânico e da barra. Gostei mais da Barra pelo espaço, que é maior. Um lugar bonito, agradável, de bom atendimento, comida deliciosa. Nos dias dos mariachos é muito animado! Musica boa! Super recomendo!",2,0.9869512319564819,0.008186405524611473,0.004862356930971146,[]
"Comida boa, atendimento rápido, música animada , ambiente legal, drinks bonitos e gostosos e decoração super adequada ao clima do local",2,0.9785798788070679,0.013065947219729424,0.00835421122610569,[]
"Minha primeira vez na casa, comida maravilhosa, ótimo atendimento e música muito boa. Voltarei com certeza!",2,0.9843078255653381,0.008054440841078758,0.007637695409357548,[]
"A comida é uma delícia, o restaurante é todo temático garçons, ambiente em música. 
Volto sempre q posso.",2,0.4505656957626343,0.11650287359952927,0.43293139338493347,[]
"Gostei muito, não só pela temática (é tudo lindo, muito bem decorado) e pela comida (uma delícia) mas também pelo clima! Estive lá em uma sexta-feira e teve uma atração com músicos e tequileiros, muito animado! Acho uma ótima opção para ir com amigos e...Mais",2,0.9014301300048828,0.05566946044564247,0.04290032759308815,[]
"Excelente ambiente com boa comida, garçons solicitos e música animada! Adoramos os chapéus pra tirar fotos!!",2,0.982879102230072,0.011883115395903587,0.005237808916717768,[]
"Fomos numa segunda de muita chuva e já recepcionados por um show ao vivo incrível, cantor caracterizado que interage a todo momento com os clientes, sendo sorteados rodadas de tequilas servidos por uma tequileira vinda de Cancún. Comida veio muito rápida e digo que foi...Mais",2,0.7085776329040527,0.073668472468853,0.21775385737419128,"[('Cancún', 'I-LOC')]"
"Restaurante muito bom, divertido..comida gostosa, vários drinks, tem dj... atendimento rápido.
Adorei e super recomendo",2,0.977626383304596,0.0122666722163558,0.010107027366757393,[]
"Comida colorida, de tempero apurado e música regional de bom gosto!!!

Outra descolada seria os tabltets em todas as mesas. Você se acomoda, escolhe, solicita e o garçom já traria seu pedido... Tudo muito eficaz...",2,0.8899449110031128,0.026239918544888496,0.08381520956754684,[]
"Local super agradável e bem localizado. Pessoal super gentil e atencioso. Muito animado, com muita música e Mariachis super empolgados! Comida excelente! Com certeza um local para se divertir com os amigos. Mas chegue cedo, senão a fila é cruel!",2,0.897460401058197,0.02211553230881691,0.08042411506175995,"[('Maria', 'I-MISC')]"
"Experiência muito interessante, comida boa, decoração incrível e música animada. Voltaremos com certeza outras vezes",2,0.9807345271110535,0.009393198415637016,0.009872225113213062,[]
"Muito bom atendimento! Comida e bebida excelentes, chegam rápido e certinhas. Música boa e ambiente tranquilo",2,0.9531859159469604,0.01249304786324501,0.034321121871471405,[]
"Ambiente super agradável, música e comida maravilhosa. 
Atendimento excelente, super atenciosos e educados.",2,0.9889257550239563,0.007473346311599016,0.003600978059694171,[]
"Melhor música com banda ao vivo, muito animados! 
Ambiente aconchegante e ótimo atendimento.
O pedido não demora e a comida é ótima!",2,0.9268725514411926,0.028637319803237915,0.04449014365673065,[]
"Ambiente alegre, moderno e com auto atendimento. Os pedidos são comandados na mesa em tablets.
Os atendentes são atenciosos, quando solicitados.
Comida típica saborosa.
Música ambiente excelente.",2,0.9620295166969299,0.02998996526002884,0.00798056460916996,[]
"Ambiente ok , comida maravilhosa, musicos sao otimos atendimento 100% !!  Decoração espetacular. Venham!",2,0.9641476273536682,0.0195815060287714,0.01627081260085106,[]
"Tudo maravilhoso.
Atendimento muito bom 
Comida maravilhosa  e drinks deliciosas.
Frida Kahlo , linda!
Música ótima 
Ficamos no segundo andar.
Mas na próxima vez quero ficar embaixo por causa da música.",2,0.9790958166122437,0.011052818968892097,0.009851379320025444,"[('Frida', 'I-PER'), ('Kahlo', 'I-PER')]"
"Eu e meu esposo viemos para conhecer o espaço pela primeira vez, e ficamos encantados. A comida maravilhosa, sem ter nada pra colocar defeito, música boa e o atendimento além de ser muito bom foi também muito rápido.",2,0.974107563495636,0.018271615728735924,0.007620771415531635,[]
Maravilhoso!muito animado.adorei. Maravilhoso. Recomendo.musica boa. Show de bola. Comida e drinks bons.,2,0.9933205842971802,0.0038717545103281736,0.0028077256865799427,[]
"Show! Muito bom, recomendo!
Lugar muito bom, música agradável, bom atendimento! Preço bom! Show de bola",2,0.992982029914856,0.0038058501668274403,0.003212121780961752,[]
"Atendimento ótimo, comida deliciosa e espaço bem legal e temático.
  Tacos e burrico muito bom, banda mt legal.",2,0.594057559967041,0.05765466392040253,0.34828776121139526,[]
"Amei o ambiente pois é bem aconchegante, temático e um local onde toda a familia pode ir para se divertir muito. O que mais me chamou a atenção foram as musicas, os tequileiros e os hombres a caráter, são ótimos! A comida é MARAVILHOSA, bebidas...Mais",2,0.82225501537323,0.04524972662329674,0.1324952095746994,[]
"Lugar agradável, espaçoso, bom atendimento, comida gostosa e música com DJ Will Pedra impecável! Diversão garantida!",2,0.8995862007141113,0.03068908303976059,0.06972470879554749,"[('Will', 'I-PER'), ('Pedra', 'I-PER')]"
"Comida, bebida, atendimento e música espetaculares. Um dos melhores restaurantes que já fui em toda a minha vida.",2,0.9348011016845703,0.028342152014374733,0.03685682266950607,[]
"Muito bom, excelente recepção e super animado. Adorei a música, o ambiente e os garçons muito receptivos! Além do cardápio excelente!",2,0.9916451573371887,0.005262089427560568,0.0030927234329283237,[]
"Adorei o restaurante e o atendimento, muita diversão, muita alegria, várias gargalhadas com os cantores e os tequileiros",2,0.9301987886428833,0.022484172135591507,0.047317031770944595,[]
"Amei a decoração!! A comida muito saborosa e pouco tempo de espera no preparo. Única coisa negativa é a poluição sonora, música do ambiente com o show cover.",2,0.9039387106895447,0.028695005923509598,0.0673663541674614,[]
"É a segunda vez que fui e foi melhor ainda. Pedimos o combo que serve 2 a 3 pessoas e drinks excelentes, mesmo para nos que não bebemos whisky ou rum. Show é muito divertido e tem apoio de um DJ. Cheguem cedo, até 20:00....Mais",2,0.876282811164856,0.06425955146551132,0.05945765599608421,[]
"Lugar sensacional, animado, divertido, atendimento nota 1000. Imperdível. Musica animada ao vivo. Uma das maravilhas do Rio.",2,0.9257659912109375,0.0280462633818388,0.04618768021464348,"[('Rio', 'I-LOC')]"
"4 estrelas? Oportunidades de melhoria: Poderiam aceitar mais cartões refeição, couvert caro. O couvert era legal, mas a música ambiente deu um clima muito melhor, pena que ligaram tão tarde.

Vamos falar das boas atribuições...

Atendimento digital/pessoal: A modernidade do atendimento foi sensacional. Realizado pelo...Mais",2,0.8577442765235901,0.05133300647139549,0.09092267602682114,[]
"Se você tem até 20 anos, quer sair com sua turma de amigos para um lugar barulhento e não tem muita exigência quanto ao atendimento, ok, vá ao Guacamole. A comida é bem gostosa mas a música ao vivo, o volume de voz nas mesas...Mais",2,0.5879620313644409,0.3615116477012634,0.05052627995610237,"[('Guacamole', 'I-LOC')]"
"O tequileiro eh gente bonissima!! A comida estava muito boa, a musica mega animada animou demais a noite",2,0.9924588799476624,0.005316130816936493,0.002224961295723915,[]
"Primeira vez qye vengo e achei o Lugar animado, atendentes educados e a decoraçăo maravilhosa!
Os musicos sao demais!!!",2,0.9655395746231079,0.015473028644919395,0.01898728311061859,[]
"Musica ao vivo, pratos diversos, ambiente grande. Pedidos são feitos diretamente pelo tablete na mesa, os pedidos chegam rapido",2,0.6652765870094299,0.06386558711528778,0.27085787057876587,[]
"Ótima comida, boa música, ótimo atendimento e bebida excelente!!! Muito animado e perfeito para sair com amigos",2,0.9898039102554321,0.006332983262836933,0.00386312254704535,[]
"Atendimento excelente da Maria 
Amei o ambiente , músicas ótimas 
Super indico vou voltar com certeza!",2,0.9719182848930359,0.014558503404259682,0.013523293659090996,"[('Maria', 'I-PER')]"
"Super recomendo, ambiente aconchegante, musica legal e atendimento excelente! Super recomendo para toda família e Amigos.",2,0.9862697720527649,0.009007303044199944,0.004722924437373877,[]
"Maravilhoso o lugar, o clima é super animador. Garçons simpáticos e banda muito animada. Super temático recomendo muito",2,0.968913733959198,0.015592909418046474,0.015493446961045265,[]
"Amei a experiência! Super recomendo. Comida e bebidas variadas. A música faz com que o ambiente fique ainda melhor. Com certeza, voltarei.",2,0.981554388999939,0.0115478141233325,0.006897836457937956,[]
"Comida gostosa, atendimento excelente com direito a canções clássicas ao vivo pelos mariachi. Recomendo demais.",2,0.9738134145736694,0.013707519508898258,0.012479042634367943,[]
"Decoração super caprichada, boa bebida, boa comida apesar de não ser maravilhosa, boa música. Lugar divertidíssimo para ir com amigos ou mesmo em casal. Por isso tudo muita fila na porta até as 22:30. Ponto negativo é que havia muita criança até depois das 21h...Mais",2,0.8693251609802246,0.05631086602807045,0.07436400651931763,[]
"Ótima musica, dj bem bonito, comida muito boa e temperada, funcionários muito animados e ambiente agradável!!",2,0.9917665123939514,0.0055380575358867645,0.0026954314671456814,[]
"Comida muito boa, ambiente bacana e bem animado. Atendimento no tablet bem atrativo e música boa. 2022",2,0.9246366620063782,0.03595242276787758,0.039410896599292755,[]
"Ambiente bonito, agradável, comida gostosa, música boa!
Boa localização, cover artístico divertido!!",2,0.9928913116455078,0.005323103629052639,0.0017856428166851401,[]
"Boa comida, atendimento rápido e cordial e música divertida! Já fomos muitas vezes e amamos! 👏🏼😊🌮",2,0.9555665254592896,0.02288772724568844,0.021545687690377235,[]
"Atendentes super atenciosas. 
Cardápio para @s froux@s com pimenta, como eu,rs
Ambiente animado. 
Ótimos músicos.",2,0.8883986473083496,0.03169804438948631,0.07990337908267975,[]
Muito bom ambiente comida música  alegre e aconchegante o dj do dia que não era tão bom ... mesmo assim valeu curtimos muito,2,0.7370582818984985,0.11089478433132172,0.15204690396785736,[]
"Local ótimo para curtir a noite, muita música a noite! me diverti muito, com certeza virei muito mais vezes!",2,0.9191096425056458,0.02819138951599598,0.052698906511068344,[]
"Ambiente maravilhoso, atendentes super atenciosos, musica ótima e o preço super dentro do orçamento.",2,0.9597654342651367,0.014095056802034378,0.02613944746553898,[]
"Porções bem servidas e
Saborosas. Preço justo. Local bem decorado e agradável. Tocam música em todas as mesas, bem divertido. Cardápio digital, facilita bastante. Vale a pena conhecer.",2,0.9528281092643738,0.031621407717466354,0.015550523065030575,[]
"Casa muito bacana, musica excelente, atendimento show de bola e o tequileiro el trapo que é muito animadoo",2,0.9552488923072815,0.016942335292696953,0.02780877985060215,"[('el', 'I-PER'), ('trapo', 'I-PER')]"
"Ambiente super divertido, música Boa. Ótimo lugar para uma festa, Boa bebida e muita diversão. Excelente para festas",2,0.9801499843597412,0.013985677622258663,0.005864319391548634,[]
"Local animado. Bom para ir em grupo. Bom chegar cedo. Comida boa. Música divertida. 
Sempre uma boa opção.",2,0.9638224244117737,0.02438380941748619,0.01179375872015953,[]
"Melhor atendimento impossível
Ambiente muito animado e atendimento especial!
Cerveja gelada e ótimo preço
Música boa 👍🏼",2,0.9637417793273926,0.02298038639128208,0.013277838006615639,[]
"Ambiente bacana, música legal, comidas boas, preço legal, um ambiente muito bom para ficar e relacar com os amigos.",2,0.9153563976287842,0.027738286182284355,0.05690532550215721,[]
"Muito bom, divertido e otimo atendimento e com musicos maravilhosos. Para ir com familia e amigos! Vale a pena conferir.",2,0.972711443901062,0.010861240327358246,0.016427259892225266,[]
"Bom restaurante, ambiente com decoração e canções típicas, e bom atendimento. Preço justo e tudo a la carte. A rua onde fica é quase impossível achar vaga para estacionar.",2,0.8817209005355835,0.042482975870370865,0.07579609006643295,[]
"Lugar de muita diversao,deveras engraçado, com comidas de dar água na boca, ao chegar aqui neste esplêndido local,meu humor muda instantaneamente,me sinto mais vivo doque nunca,começo a dançar e não paro mais, musica agradável, tenho uma amiga, que está aqui ao meu lado, além do...Mais",2,0.5682498812675476,0.17677907645702362,0.2549709677696228,[]
Um restaurante maravilhoso.Belíssima decoração. Música e diversão sem igual no estado do RJ. Boa localização.,2,0.9504489302635193,0.030967172235250473,0.018583940342068672,"[('<s>', 'I-LOC'), ('RJ</s>', 'I-LOC')]"
"Ótima música, ótimo cardápio e atendimento perfeito. Local bem localizado, funcionários gentis e simpáticos",2,0.31905731558799744,0.09412015229463577,0.5868225693702698,[]
"Me divertir como nunca, fomos para jantar e nos surpreendemos positivamente, porque a animaçao dos mariachis e dj é espetacular, sem falar na equipe de garçons que dao um show.",2,0.790285050868988,0.08028798550367355,0.12942689657211304,[]
"Pensa num lugar bom, é aqui! Eu to embasbacado com a ambientação desse lugar.... surpreendente! To me sentindo no México!!!! Ariba, abarro, adentro a centro não sei como se fala pq estou bebadooooooo... tequilaaaa, tequilaaaaa, tequilaaaa!!!",2,0.7654657959938049,0.04874790832400322,0.18578626215457916,"[('México', 'I-LOC')]"
"Atendentes simpáticos, prestativos e ótimo atendimento. Pratos variados e muito gostosos. 
Ambiente com músicas variadas e ambiente bastante familiar. 
Super recomendo!!!!",2,0.9582806825637817,0.02387794852256775,0.01784132979810238,[]
Excelente comida!! Ótimo atendimento...música Boa. Atendente Alisson super simpático e atencioso.valeu cada real gasto,2,0.9830369353294373,0.011861409060657024,0.005101669579744339,"[('Alisson', 'I-PER')]"
"Ambiente temático, comida gostosa, música boa, preços justos e muitas promoções.

Entretanto, atendimento a desejar, principalmente pela garçonete Aline. Muito antipática, pouco solícita e rude nas respostas.",2,0.5770910382270813,0.11485400050878525,0.30805495381355286,"[('Aline', 'I-PER')]"
"Ambiente descontraído e aconchegante. Música boa, equipe com ótimo atendimento e preços justos. 

Vale muito a pena ir com os amigos e curtir o happy hour, ou melhor: La hora feliz!",2,0.9470892548561096,0.02644728682935238,0.026463568210601807,[]
"Excelente lugar , lugar encantador muita animação música e comida saborosa deliciosas sobremesas 😍😍😍",2,0.9786173105239868,0.01317413616925478,0.008208578452467918,[]
"Ambiente muito agradável, música boa, excelente atendimento. Comida boa, chega bem rápido. Gabriel muito atencioso!",2,0.9899985194206238,0.006618170533329248,0.0033833058550953865,"[('Gabriel', 'I-PER')]"
"Ambiente excelente com otima musica, boa bebida e comida. Otimo local para celebrar com amigos e famila.",2,0.9864736795425415,0.009375316090881824,0.004151029046624899,[]
"Eu e minhas amigas fomos mt bem atendidas, comida muito boa, drinks muito bons, muita música, alegria!",2,0.9826980233192444,0.009667386300861835,0.007634545676410198,[]
"Um dos melhores da lugares que já fui.. atendimento diferenciado, bar temático com músicos, comida boa, ótimo k pra quem procura um lugar diferente para diversão",2,0.8596887588500977,0.04606473445892334,0.0942465290427208,[]
"Cobrança da apresentação dos músicos não me agradou, pensei que iriam tocar a noite toda, acho que os músicos foi só um adereço.Mais",2,0.17190386354923248,0.22508002817630768,0.6030160784721375,[]
"Muito bom, um lugar com um ótimo atendimento e a comida é muito boa, cerveja muito gelada e a música impecável . Ameeeeeeeei!",2,0.9338533878326416,0.024604367092251778,0.041542232036590576,[]
"Comida ótima, boa música, staff competente (principalmente Kaylene e Victor, muito simpáticos). Recomendo o burrito.",2,0.8586000800132751,0.03893016651272774,0.10246971249580383,"[('Kaylene', 'I-PER'), ('Victor', 'I-PER')]"
"Lugar agradável, com atendimento maravilhoso!! 
O garçom John é incrível! 
A hora feliz faz o valor dos drinks valer a pena.
O clima fica muito animado com a música!",2,0.9375537037849426,0.015547097660601139,0.04689918830990791,"[('John', 'I-PER')]"
Comida  e música boa. atendimento melhor ainda! Sempre que posso vou. Melhor restaurante da barra da Tijuca! 😍😍,2,0.9645906686782837,0.022033559158444405,0.013375738635659218,"[('Tijuca', 'I-LOC')]"
"Ótimo lugar
Garçom chará
Lugar simpático
Boa musica
Ar condicionado 
Cerveja gelada
Comida quente 
Voltaremos",2,0.7930811643600464,0.07992453128099442,0.1269942969083786,[]
"O rodízio é interessante, mas nada fora do normal, faltou um pouco de pimenta. O ambiente é legal, mas a música junina não foi muito agradável, apesar de entender que é a temática do mês nos restaurantes.",2,0.2905089855194092,0.3393094837665558,0.3701815605163574,[]
"Muito bom, barzinho de qualidade incomparável, musica muito boa e comida excelente. Eu super indico para todos.",2,0.9899898767471313,0.005888901650905609,0.004121279343962669,[]
"Sem palavras tudo perfeito!!!!

Foi eu e minha namorada desfrutar de todas as magnéticas comidas e bebidas q esse restaurante sensacional proporciona.............!

Obrigado a todos !!!
Espero volta mais vezes!!",2,0.4282240867614746,0.04690375179052353,0.5248721241950989,[]
"Muito bom, música ao vivo, comida bem servida e temperada. Ambiente com musica agradável e caracterizado.",2,0.9443171620368958,0.0229863952845335,0.03269648551940918,[]
"Lugar bom, animado, divertido, alegre. Atendimento bom. Música boa, condiz com o ambiente. Lugar muito bom",2,0.9843329191207886,0.00923905335366726,0.006428062915802002,[]
"Otimo atendimento, otimo lugar para estar com a familia. Boa musica, comida saborosa e ambiente muito agradavel.",2,0.9611373543739319,0.025643572211265564,0.013219029642641544,[]
"Excelente ambiente, com garçons super atenciosos, música numa altura agradável para conversar e se divertir com os amigos!",2,0.9853771328926086,0.008717232383787632,0.005905553698539734,[]
"Lugar super agradável, funcionários atenciosos, pratos e bebidas com valores justos.
Muita diversão e descontração.
Os Mariates são ótimos e o DJ tb, que no final da noite junto com outros funcionários com fantasias animam com dança.",2,0.7580153942108154,0.051909346133470535,0.19007517397403717,[]
"Lugar top!! Bom atendimento e agilidade, boa comida!!!

Bons drinks!! 
Musica boa!!! Tem boate depois de 23 horas!!",2,0.9889145493507385,0.007530245929956436,0.0035552335903048515,[]
Adorei!!! Visitei a filial do Jardim Botânico. O atendimento foi muito bom: atendentes simpáticos e prestativos. Os tequileiros fazem a festa dos clientes com direito a Mariachi's e música ao vivo. Recomendo!,2,0.9652031660079956,0.011062520556151867,0.02373429760336876,"[('Jardim', 'I-LOC'), ('Botânico', 'I-LOC'), ('Maria', 'I-MISC')]"
Música boa. Comida sensacional. Drinks variados e saborosos. Ótimo para curtir com os amigos e família!,2,0.9799267649650574,0.011598057113587856,0.0084751658141613,[]
Gostei muito da casa o atendimento e ótimo a comida 'musica tudo 100 pontos !!voltaremos com certeza,2,0.8626344203948975,0.03814820572733879,0.09921732544898987,[]
"Espaço maravilhoso , com músicas temáticas e apresentações individuais de mesa em mesa,   ótimo atendimento e colaboradores extremamente atenciosos e prestativos.  Vale a pena a visita.",2,0.9598354697227478,0.015605124644935131,0.02455933392047882,[]
Excelente bebida e comida. Restaurante muito animado com atracoes de musica e bebida. Localizacao otima.,2,0.9828989505767822,0.01168459840118885,0.005416468717157841,[]
"Adorei o ambiente, a música, o atendimento e a comida. Todos muito profissionais e educados. Com certeza voltarei!",2,0.8718109726905823,0.056364864110946655,0.07182405143976212,[]
"ótimo para reunir os amigos, musicos contagiantes , ambiente bem decorado  ,comida  muito boa, publico jovem",2,0.9783974885940552,0.012397359125316143,0.00920515414327383,[]
"Restaurante com um clima agradável, música animada, fincionários solícitos, ambiente limpo e comida muito boa!",2,0.9504157304763794,0.02151043899357319,0.028073718771338463,[]
"Muito incrível o restaurante. Comida maravilhosa e bebida impecável. Atendimento muito bom, os músicos talentosos e ambiento lindo.",2,0.9371321201324463,0.02274688519537449,0.040120989084243774,[]
Ambiente climatizado e bem decorado na temática do México. Atendentes prestativos e simpáticos. Tecnologia para realizar os pedidos que são atendidos rapidamente. Música temática de qualidade. Limpeza e organização ótima.,2,0.9241161346435547,0.03411432355642319,0.04176952689886093,"[('México', 'I-LOC')]"
"Ótimo lugar com músicas boas atendentes super atenciosos, ambiente super aconchegante realmente me senti no mexico voltarei concerteza.super indico resenha com amigos,ou encontro em família, excelente para todas as datas.",2,0.9749144911766052,0.013073732145130634,0.012011772952973843,"[('mexico', 'I-LOC')]"
Serviço de alta qualidade e muito boa a comida! Tudo ótimo no estabelecimento! A música também é muito agradável!,2,0.9745582938194275,0.011715701781213284,0.013726012781262398,[]
"Local ótimo , com comida excelente,música boa na verdade o lugar é tudo de bom. Parada obrigatória em Porto Alegres",2,0.9638659358024597,0.018626796081662178,0.017507217824459076,"[('Porto', 'I-LOC'), ('Alegre', 'I-LOC')]"
"Ambiente agradável, divertido, amistoso, ótima trilha sonora, excelente atendimento, comida deliciosa e sem contar na decoração sem igual. 
Ps: os mariates são divertidíssimos.",2,0.9685614705085754,0.019834527745842934,0.011603941209614277,[]
"Local animado, comida atende a expectativa. Bem servido e atendimento rápido. Tem música alta, restaurante para quem quer animação sem ser noitada de boate.",2,0.9004161357879639,0.05791663005948067,0.041667159646749496,[]
Gostei muito do ambiente e do atendimento. Equipe bem treinada e super rápida. Decoração e música muito boas!!!,2,0.954933226108551,0.019196558743715286,0.025870196521282196,[]
"Lugar alto astral, música boa, atendimento bom, comida boa, bela decoração, fomos no fim de semana, apesar de bem cheio o serviço estava rápido.",2,0.9724262952804565,0.013204465620219707,0.014369301497936249,[]
"Esse lugar é para todos os momentos. Tudo é maravilhoso, da comida ao atendimento. E is músicos day maravilhosos!",2,0.9726406335830688,0.015418973751366138,0.011940395459532738,[]
"Comida boa, meio cara, mas é Barra... Bem animado. Mas é MUITO barulhento!!  Os atendentes são educados, comida boa, banheiro limpo, mas a música...se vc quer um lugar pra comer e conversar, não É o local. Mas é bem animado. Dá pra vc dançar e...Mais",2,0.5460871458053589,0.21919651329517365,0.23471634089946747,"[('Barra', 'I-LOC')]"
"Ambiente agradável, música ambiente bem selecionadas, otimos garçons, e comida maravilhosa  
Sempre voltarei",2,0.9503311514854431,0.024858031421899796,0.02481086552143097,[]
"É a primeira vez que venho ao estabelecimento e fui super bem recebido. Comida da melhor qualidade, lugar alegre, energia positiva e música contagiante... Resumindo estou me sentindo muito confortável e feliz nesse lugar. Voltarei mais vezes com certeza!",2,0.9872484803199768,0.007669555488973856,0.005081963259726763,[]
"Restaurante muito animado, comida ótima, amei tudo principalmente a banda ótima e muito boa!
Vale a pena conhecer!",2,0.9807333946228027,0.009360418654978275,0.009906231425702572,[]
Adoro a comida do Guaca...Muito descontraído com tequileiros andando pelo salão. Tem musica ao vivo que os cantores e instrumentistas vão ate as mesas cantar.,2,0.5848824977874756,0.11603039503097534,0.29908713698387146,"[('Guaca', 'I-PER')]"
"Otimo atendimento de toda equipe da casa, execlente musica ao vivo com os mariates! Comida estava excelente!  Suuuuuuuper recendo",2,0.9762844443321228,0.012913514859974384,0.010802052915096283,[]
