Date,Review,Review_Topic,Review_Entity,Topics,Names,Representation,Representative_Docs,Positive,Neutral,Negative,Highest Score,Sentiment,Token Predictions Corrected
20 de novembro de 2023,"Amei o atendimento da Kaylane e Victor! Os melhoress, comemos muito bem e foram muitos simpáticos. Obrigada pela ajuda",atendimento,"Amei o atendimento da Kaylane e Victor! Os melhoress, comemos muito bem e foram muitos simpaticos. Obrigada pela ajuda",0,0_lugar_atendimento_aniversario_amigo,"['lugar', 'atendimento', 'aniversario', 'amigo', 'ambiente', 'funcionario', 'certeza', 'vez', 'familia', 'casa']","['lugar decoracao atendimento lugar amigo familia', 'atendimento garcons lugar amigo lugar aniversario', 'lugar atendimento aniversario amigo']",0.9580621123313904,0.01777394488453865,0.02416401542723179,0.9580621123313904,Positive,"[('Kaylane', 'I-PER'), ('Victor', 'I-PER')]"
19 de novembro de 2023,"Lugar e pessoas muito gentis e educadas. Fomos atendidos por um garçom incrível, Mateus. Vamos voltar sem dúvidas!",lugar pessoa garcom duvida,"Lugar e pessoas muito gentis e educadas. Fomos atendidos por um garcom incrivel, Mateus. Vamos voltar sem duvidas!",0,0_lugar_atendimento_aniversario_amigo,"['lugar', 'atendimento', 'aniversario', 'amigo', 'ambiente', 'funcionario', 'certeza', 'vez', 'familia', 'casa']","['lugar decoracao atendimento lugar amigo familia', 'atendimento garcons lugar amigo lugar aniversario', 'lugar atendimento aniversario amigo']",0.4870445430278778,0.07418027520179749,0.4387751817703247,0.4870445430278778,Positive,"[('Mateus', 'I-PER')]"
11 de novembro de 2023,"Excelente atendimento, amei a experiência! 
Rodízio com bastante variedade e comida deliciosa, só tenho a agradecer",atendimento experiencia variedade,"Excelente atendimento, amei a experiencia! 
Rodizio com bastante variedade e comida deliciosa, so tenho a agradecer",0,0_lugar_atendimento_aniversario_amigo,"['lugar', 'atendimento', 'aniversario', 'amigo', 'ambiente', 'funcionario', 'certeza', 'vez', 'familia', 'casa']","['lugar decoracao atendimento lugar amigo familia', 'atendimento garcons lugar amigo lugar aniversario', 'lugar atendimento aniversario amigo']",0.9904220104217529,0.005675188731402159,0.0039028029423207045,0.9904220104217529,Positive,[]
6 de novembro de 2023,Pegamos o rodízio. A comida estava muito gostosa e os atendentes são muito atenciosos com os clientes. Voltarei com certeza!,rodizio atendente certeza,Pegamos o rodizio. A comida estava muito gostosa e os atendentes sao muito atenciosos com os clientes. Voltarei com certeza!,0,0_lugar_atendimento_aniversario_amigo,"['lugar', 'atendimento', 'aniversario', 'amigo', 'ambiente', 'funcionario', 'certeza', 'vez', 'familia', 'casa']","['lugar decoracao atendimento lugar amigo familia', 'atendimento garcons lugar amigo lugar aniversario', 'lugar atendimento aniversario amigo']",0.9122679829597473,0.027836356312036514,0.0598955862224102,0.9122679829597473,Positive,[]
29 de outubro de 2023,"sim bem boaAlém das diretrizes gerais da comunidade, temos diretrizes específicas para a publicação de avaliações. As avaliações são publicadas no perfil de estabelecimentos e associadas a uma pontuação por círculos de 1 a 5. As pontuações afetam a posição no ranking de popularidade do...Mais",diretriz comunidade diretriz publicacao avaliacao avaliacao perfil pontuacao circulo pontuacao posicao popularidade,"sim bem boaAlem das diretrizes gerais da comunidade, temos diretrizes especificas para a publicacao de avaliacoes. As avaliacoes sao publicadas no perfil de estabelecimentos e associadas a uma pontuacao por circulos de 1 a 5. As pontuacoes afetam a posicao no ranking de popularidade do...Mais",0,0_lugar_atendimento_aniversario_amigo,"['lugar', 'atendimento', 'aniversario', 'amigo', 'ambiente', 'funcionario', 'certeza', 'vez', 'familia', 'casa']","['lugar decoracao atendimento lugar amigo familia', 'atendimento garcons lugar amigo lugar aniversario', 'lugar atendimento aniversario amigo']",0.8310915231704712,0.07710560411214828,0.09180286526679993,0.8310915231704712,Positive,[]
28 de outubro de 2023,"Amei a experiência, ótimo ambiente, divertido para ir com amigos e familia,  atendimento excelente do Breno",experiencia ambiente amigo atendimento,"Amei a experiencia, otimo ambiente, divertido para ir com amigos e familia,  atendimento excelente do Breno",0,0_lugar_atendimento_aniversario_amigo,"['lugar', 'atendimento', 'aniversario', 'amigo', 'ambiente', 'funcionario', 'certeza', 'vez', 'familia', 'casa']","['lugar decoracao atendimento lugar amigo familia', 'atendimento garcons lugar amigo lugar aniversario', 'lugar atendimento aniversario amigo']",0.9748522043228149,0.015195053070783615,0.009952736087143421,0.9748522043228149,Positive,"[('Breno', 'I-PER')]"
28 de outubro de 2023,"Maravilha tudo de bom 
Amei! Tudo perfeito, deejay uma maravilha garçom também meus amigos amaram muito",deejay garcom,"Maravilha tudo de bom 
Amei! Tudo perfeito, deejay uma maravilha garcom tambem meus amigos amaram muito",0,0_lugar_atendimento_aniversario_amigo,"['lugar', 'atendimento', 'aniversario', 'amigo', 'ambiente', 'funcionario', 'certeza', 'vez', 'familia', 'casa']","['lugar decoracao atendimento lugar amigo familia', 'atendimento garcons lugar amigo lugar aniversario', 'lugar atendimento aniversario amigo']",0.9668821692466736,0.01140125747770071,0.021716488525271416,0.9668821692466736,Positive,[]
26 de outubro de 2023,amei!!!!,,amei!!!!,0,0_lugar_atendimento_aniversario_amigo,"['lugar', 'atendimento', 'aniversario', 'amigo', 'ambiente', 'funcionario', 'certeza', 'vez', 'familia', 'casa']","['lugar decoracao atendimento lugar amigo familia', 'atendimento garcons lugar amigo lugar aniversario', 'lugar atendimento aniversario amigo']",0.688386082649231,0.12032990157604218,0.19128406047821045,0.688386082649231,Positive,[]
23 de outubro de 2023,"Rodízio excelente, bastante opções e excelente atendimento. A opção de bebida também estava muito saborosa.",rodizio opcao atendimento opcao,"Rodizio excelente, bastante opcoes e excelente atendimento. A opcao de bebida tambem estava muito saborosa.",0,0_lugar_atendimento_aniversario_amigo,"['lugar', 'atendimento', 'aniversario', 'amigo', 'ambiente', 'funcionario', 'certeza', 'vez', 'familia', 'casa']","['lugar decoracao atendimento lugar amigo familia', 'atendimento garcons lugar amigo lugar aniversario', 'lugar atendimento aniversario amigo']",0.984527587890625,0.011134995147585869,0.004337443970143795,0.984527587890625,Positive,[]
20 de outubro de 2023,"Otimo! Adorei a experiência! Foi tudo maravilhoso e delicioso. Mas os preços são um pouco altos, mas tudo ótima qualidade",experiencia preco qualidade,"Otimo! Adorei a experiencia! Foi tudo maravilhoso e delicioso. Mas os precos sao um pouco altos, mas tudo otima qualidade",0,0_lugar_atendimento_aniversario_amigo,"['lugar', 'atendimento', 'aniversario', 'amigo', 'ambiente', 'funcionario', 'certeza', 'vez', 'familia', 'casa']","['lugar decoracao atendimento lugar amigo familia', 'atendimento garcons lugar amigo lugar aniversario', 'lugar atendimento aniversario amigo']",0.9674761295318604,0.014256268739700317,0.01826760359108448,0.9674761295318604,Positive,[]
18 de setembro de 2023,Lugar muito legal para curtir a noite de aniversário com a família e com os amigos fazer fotos incríveis que servirá de recordação por um momento especial,lugar noite amigo foto recordacao momento,Lugar muito legal para curtir a noite de aniversario com a familia e com os amigos fazer fotos incriveis que servira de recordacao por um momento especial,0,0_lugar_atendimento_aniversario_amigo,"['lugar', 'atendimento', 'aniversario', 'amigo', 'ambiente', 'funcionario', 'certeza', 'vez', 'familia', 'casa']","['lugar decoracao atendimento lugar amigo familia', 'atendimento garcons lugar amigo lugar aniversario', 'lugar atendimento aniversario amigo']",0.5713858604431152,0.15597787499427795,0.272636353969574,0.5713858604431152,Positive,[]
15 de setembro de 2023,"Bom lugar para socializar, som ambiente com muita alegria por parte das atrações. Super indico a todos!",lugar som alegria atracao,"Bom lugar para socializar, som ambiente com muita alegria por parte das atracoes. Super indico a todos!",0,0_lugar_atendimento_aniversario_amigo,"['lugar', 'atendimento', 'aniversario', 'amigo', 'ambiente', 'funcionario', 'certeza', 'vez', 'familia', 'casa']","['lugar decoracao atendimento lugar amigo familia', 'atendimento garcons lugar amigo lugar aniversario', 'lugar atendimento aniversario amigo']",0.9695330262184143,0.014630013145506382,0.01583700440824032,0.9695330262184143,Positive,[]
5 de setembro de 2023,"Otimo local,bem temático, serviço otimo.
Super recomendo tanto para familia quanto para amigos. Bebidas maravilhosas.",local servico familia amigo bebida,"Otimo local,bem tematico, servico otimo.
Super recomendo tanto para familia quanto para amigos. Bebidas maravilhosas.",0,0_lugar_atendimento_aniversario_amigo,"['lugar', 'atendimento', 'aniversario', 'amigo', 'ambiente', 'funcionario', 'certeza', 'vez', 'familia', 'casa']","['lugar decoracao atendimento lugar amigo familia', 'atendimento garcons lugar amigo lugar aniversario', 'lugar atendimento aniversario amigo']",0.9708809852600098,0.014374828897416592,0.014744249172508717,0.9708809852600098,Positive,[]
27 de julho de 2023,"Segunda vez que venho. E as duas vezes tive uma ótima experiência. Atendimento, comida, ambiente, agilidade, e o sistema do cardápio é MT demais... Fácil, prático, e agiliza o pedido. Parabéns!",vez vez experiencia agilidader sistema cardapio parabens,"Segunda vez que venho. E as duas vezes tive uma otima experiencia. Atendimento, comida, ambiente, agilidade, e o sistema do cardapio e MT demais... Facil, pratico, e agiliza o pedido. Parabens!",0,0_lugar_atendimento_aniversario_amigo,"['lugar', 'atendimento', 'aniversario', 'amigo', 'ambiente', 'funcionario', 'certeza', 'vez', 'familia', 'casa']","['lugar decoracao atendimento lugar amigo familia', 'atendimento garcons lugar amigo lugar aniversario', 'lugar atendimento aniversario amigo']",0.7617495059967041,0.07779790461063385,0.16045257449150085,0.7617495059967041,Positive,[]
19 de julho de 2023,"Muito divertido para celebrar aniversário em família. Ambiente descontraido, bem decorado e animado. Adoramos",aniversario,"Muito divertido para celebrar aniversario em familia. Ambiente descontraido, bem decorado e animado. Adoramos",0,0_lugar_atendimento_aniversario_amigo,"['lugar', 'atendimento', 'aniversario', 'amigo', 'ambiente', 'funcionario', 'certeza', 'vez', 'familia', 'casa']","['lugar decoracao atendimento lugar amigo familia', 'atendimento garcons lugar amigo lugar aniversario', 'lugar atendimento aniversario amigo']",0.9536277055740356,0.019906943663954735,0.02646535262465477,0.9536277055740356,Positive,[]
18 de julho de 2023,Este local é demasiado animado para curtir a noite em família nessa cidade maravilhosa que é o Rio de Janeiro,local noite cidade Janeiro,Este local e demasiado animado para curtir a noite em familia nessa cidade maravilhosa que e o Rio de Janeiro,0,0_lugar_atendimento_aniversario_amigo,"['lugar', 'atendimento', 'aniversario', 'amigo', 'ambiente', 'funcionario', 'certeza', 'vez', 'familia', 'casa']","['lugar decoracao atendimento lugar amigo familia', 'atendimento garcons lugar amigo lugar aniversario', 'lugar atendimento aniversario amigo']",0.881876528263092,0.0364343635737896,0.08168911188840866,0.881876528263092,Positive,"[('Rio', 'I-LOC'), ('de', 'I-LOC'), ('Janeiro', 'I-LOC')]"
15 de julho de 2023,"Ótimo ambiente para curtir com a família, comida gostosa, bom atendimento, uma opção diferente para sair da rotina!",ambiente familia atendimento opcao rotina,"Otimo ambiente para curtir com a familia, comida gostosa, bom atendimento, uma opcao diferente para sair da rotina!",0,0_lugar_atendimento_aniversario_amigo,"['lugar', 'atendimento', 'aniversario', 'amigo', 'ambiente', 'funcionario', 'certeza', 'vez', 'familia', 'casa']","['lugar decoracao atendimento lugar amigo familia', 'atendimento garcons lugar amigo lugar aniversario', 'lugar atendimento aniversario amigo']",0.9344474673271179,0.0265100859105587,0.03904245048761368,0.9344474673271179,Positive,[]
30 de junho de 2023,Amei. Tudo maravilhoso. Do atendimento à decoração. Comida incrível. Com certeza voltarei mais vezes,atendimento decoracao certeza vez,Amei. Tudo maravilhoso. Do atendimento a decoracao. Comida incrivel. Com certeza voltarei mais vezes,0,0_lugar_atendimento_aniversario_amigo,"['lugar', 'atendimento', 'aniversario', 'amigo', 'ambiente', 'funcionario', 'certeza', 'vez', 'familia', 'casa']","['lugar decoracao atendimento lugar amigo familia', 'atendimento garcons lugar amigo lugar aniversario', 'lugar atendimento aniversario amigo']",0.8951631784439087,0.03119940496981144,0.07363737374544144,0.8951631784439087,Positive,[]
30 de junho de 2023,"Maravilhoso! Nota 10! Atendimento top! Pessoas incríveis, ambiente totalmente temático e agradável,",nota atendimento pessoa ambiente,"Maravilhoso! Nota 10! Atendimento top! Pessoas incriveis, ambiente totalmente tematico e agradavel,",0,0_lugar_atendimento_aniversario_amigo,"['lugar', 'atendimento', 'aniversario', 'amigo', 'ambiente', 'funcionario', 'certeza', 'vez', 'familia', 'casa']","['lugar decoracao atendimento lugar amigo familia', 'atendimento garcons lugar amigo lugar aniversario', 'lugar atendimento aniversario amigo']",0.9562803506851196,0.017085663974285126,0.026633871719241142,0.9562803506851196,Positive,[]
28 de junho de 2023,"Muito bom o atendimento!!!!  A bebida estava ótima, o ambiente super agradável. Recomendaria para mais pessoas.",atendimento ambiente pessoa,"Muito bom o atendimento!!!!  A bebida estava otima, o ambiente super agradavel. Recomendaria para mais pessoas.",0,0_lugar_atendimento_aniversario_amigo,"['lugar', 'atendimento', 'aniversario', 'amigo', 'ambiente', 'funcionario', 'certeza', 'vez', 'familia', 'casa']","['lugar decoracao atendimento lugar amigo familia', 'atendimento garcons lugar amigo lugar aniversario', 'lugar atendimento aniversario amigo']",0.6530577540397644,0.019137198105454445,0.3278050124645233,0.6530577540397644,Positive,[]
26 de junho de 2023,Melhor atendimento! Procura o Matheus! Rodízio maravilhoso. Happy hour justo. Adoramos tudo e sempre voltaremos. Obrigada!,atendimento rodizio happy,Melhor atendimento! Procura o Matheus! Rodizio maravilhoso. Happy hour justo. Adoramos tudo e sempre voltaremos. Obrigada!,0,0_lugar_atendimento_aniversario_amigo,"['lugar', 'atendimento', 'aniversario', 'amigo', 'ambiente', 'funcionario', 'certeza', 'vez', 'familia', 'casa']","['lugar decoracao atendimento lugar amigo familia', 'atendimento garcons lugar amigo lugar aniversario', 'lugar atendimento aniversario amigo']",0.9664129018783569,0.014286518096923828,0.01930060051381588,0.9664129018783569,Positive,"[('Matheus', 'I-PER')]"
26 de junho de 2023,"Atendimento do Matheus foi excelente!
O rodízio tem um custo-benefício muito bom.
Vale muito a pena!",atendimento rodizio pena,"Atendimento do Matheus foi excelente!
O rodizio tem um custo-beneficio muito bom.
Vale muito a pena!",0,0_lugar_atendimento_aniversario_amigo,"['lugar', 'atendimento', 'aniversario', 'amigo', 'ambiente', 'funcionario', 'certeza', 'vez', 'familia', 'casa']","['lugar decoracao atendimento lugar amigo familia', 'atendimento garcons lugar amigo lugar aniversario', 'lugar atendimento aniversario amigo']",0.983252763748169,0.007032604422420263,0.00971454568207264,0.983252763748169,Positive,"[('Matheus', 'I-PER')]"
25 de junho de 2023,Atendimento nota 1000! Primeira vez que viemos aqui e nos sentimos em casa. Clima familiar é ótimo ambiente! Parabéns!!,atendimento vez casa clima parabens,Atendimento nota 1000! Primeira vez que viemos aqui e nos sentimos em casa. Clima familiar e otimo ambiente! Parabens!!,0,0_lugar_atendimento_aniversario_amigo,"['lugar', 'atendimento', 'aniversario', 'amigo', 'ambiente', 'funcionario', 'certeza', 'vez', 'familia', 'casa']","['lugar decoracao atendimento lugar amigo familia', 'atendimento garcons lugar amigo lugar aniversario', 'lugar atendimento aniversario amigo']",0.9136428236961365,0.029550325125455856,0.056806884706020355,0.9136428236961365,Positive,[]
19 de junho de 2023,"Excelente atendimento, comida maravilhosa e ambiente lindo e instagramavel! Super recomendo! 😍😍😍😍",atendimento ambiente instagramavel,"Excelente atendimento, comida maravilhosa e ambiente lindo e instagramavel! Super recomendo! ",0,0_lugar_atendimento_aniversario_amigo,"['lugar', 'atendimento', 'aniversario', 'amigo', 'ambiente', 'funcionario', 'certeza', 'vez', 'familia', 'casa']","['lugar decoracao atendimento lugar amigo familia', 'atendimento garcons lugar amigo lugar aniversario', 'lugar atendimento aniversario amigo']",0.9878635406494141,0.008472713641822338,0.003663867013528943,0.9878635406494141,Positive,[]
18 de junho de 2023,O garçom Mateus nos atendeu super bem e simpático e nós explicou bem o cardápio e foi nos dando as melhoras opções.Com certeza voltaremos,garcom cardapio opcao certeza,O garcom Mateus nos atendeu super bem e simpatico e nos explicou bem o cardapio e foi nos dando as melhoras opcoes.Com certeza voltaremos,0,0_lugar_atendimento_aniversario_amigo,"['lugar', 'atendimento', 'aniversario', 'amigo', 'ambiente', 'funcionario', 'certeza', 'vez', 'familia', 'casa']","['lugar decoracao atendimento lugar amigo familia', 'atendimento garcons lugar amigo lugar aniversario', 'lugar atendimento aniversario amigo']",0.8783930540084839,0.04083705320954323,0.08076981455087662,0.8783930540084839,Positive,"[('Mateus', 'I-PER')]"
18 de junho de 2023,"Vim comemorar o meu aniversário e antes de chegar lá já curti o agendamento de reserva no site. Simples, prático e eficiente.

Na recepção foram bem simpáticos, o atendente da nossa mesa nos serviu muito bem a tequila com apresentação e tudo.

Atendimento e comida...Mais",aniversario agendamento site recepcao atendente mesa apresentacao atendimento,"Vim comemorar o meu aniversario e antes de chegar la ja curti o agendamento de reserva no site. Simples, pratico e eficiente.

Na recepcao foram bem simpaticos, o atendente da nossa mesa nos serviu muito bem a tequila com apresentacao e tudo.

Atendimento e comida...Mais",0,0_lugar_atendimento_aniversario_amigo,"['lugar', 'atendimento', 'aniversario', 'amigo', 'ambiente', 'funcionario', 'certeza', 'vez', 'familia', 'casa']","['lugar decoracao atendimento lugar amigo familia', 'atendimento garcons lugar amigo lugar aniversario', 'lugar atendimento aniversario amigo']",0.8591537475585938,0.07495170831680298,0.06589454412460327,0.8591537475585938,Positive,[]
16 de junho de 2023,"Excelente lugar, linda decoração, comida muito boa e os mariachis são perfeitooos. Lugar super divertido para levar amigos e familiares.",lugar decoracao lugar amigo,"Excelente lugar, linda decoracao, comida muito boa e os mariachis sao perfeitooos. Lugar super divertido para levar amigos e familiares.",0,0_lugar_atendimento_aniversario_amigo,"['lugar', 'atendimento', 'aniversario', 'amigo', 'ambiente', 'funcionario', 'certeza', 'vez', 'familia', 'casa']","['lugar decoracao atendimento lugar amigo familia', 'atendimento garcons lugar amigo lugar aniversario', 'lugar atendimento aniversario amigo']",0.9845608472824097,0.009843917563557625,0.005595258437097073,0.9845608472824097,Positive,[]
16 de abril de 2023,Maria nos atendeu muitíssimo bem e a quesadilla de ovomaltine estava divina (peçam com queijo vocês não vão se arrepender).,quesadilla,Maria nos atendeu muitissimo bem e a quesadilla de ovomaltine estava divina (pecam com queijo voces nao vao se arrepender).,0,0_lugar_atendimento_aniversario_amigo,"['lugar', 'atendimento', 'aniversario', 'amigo', 'ambiente', 'funcionario', 'certeza', 'vez', 'familia', 'casa']","['lugar decoracao atendimento lugar amigo familia', 'atendimento garcons lugar amigo lugar aniversario', 'lugar atendimento aniversario amigo']",0.5864496231079102,0.08243367820978165,0.3311166763305664,0.5864496231079102,Positive,"[('Maria', 'I-PER')]"
31 de março de 2023,"Para quem é  fã do México,  pode vir que não tem erro! Perfeito!!!
Todo atendimento,  ambiente, localização! E o principal: Os Mariachis!!!",mexico erro atendimento localizacao,"Para quem e  fa do Mexico,  pode vir que nao tem erro! Perfeito!!!
Todo atendimento,  ambiente, localizacao! E o principal: Os Mariachis!!!",0,0_lugar_atendimento_aniversario_amigo,"['lugar', 'atendimento', 'aniversario', 'amigo', 'ambiente', 'funcionario', 'certeza', 'vez', 'familia', 'casa']","['lugar decoracao atendimento lugar amigo familia', 'atendimento garcons lugar amigo lugar aniversario', 'lugar atendimento aniversario amigo']",0.46180880069732666,0.08921005576848984,0.4489811658859253,0.46180880069732666,Positive,"[('Mexico', 'I-LOC'), ('Maria', 'I-MISC')]"
27 de março de 2023,"Falta de organização, + de 1 hora de rodizio e só chegou duas tortinhas e uma costela, lindao esse rodízio",faltar organizacao rodizio tortinha rodizio,"Falta de organizacao, + de 1 hora de rodizio e so chegou duas tortinhas e uma costela, lindao esse rodizio",0,0_lugar_atendimento_aniversario_amigo,"['lugar', 'atendimento', 'aniversario', 'amigo', 'ambiente', 'funcionario', 'certeza', 'vez', 'familia', 'casa']","['lugar decoracao atendimento lugar amigo familia', 'atendimento garcons lugar amigo lugar aniversario', 'lugar atendimento aniversario amigo']",0.2662891149520874,0.12859205901622772,0.6051188111305237,0.6051188111305237,Negative,[]
13 de fevereiro de 2023,"Maravilhoso, lugar e comida incríveis. Melhor ligar para comemoração de aniversário, Com certeza voltarei mais vezes",lugar comemoracao certeza vez,"Maravilhoso, lugar e comida incriveis. Melhor ligar para comemoracao de aniversario, Com certeza voltarei mais vezes",0,0_lugar_atendimento_aniversario_amigo,"['lugar', 'atendimento', 'aniversario', 'amigo', 'ambiente', 'funcionario', 'certeza', 'vez', 'familia', 'casa']","['lugar decoracao atendimento lugar amigo familia', 'atendimento garcons lugar amigo lugar aniversario', 'lugar atendimento aniversario amigo']",0.8931757807731628,0.03941216692328453,0.06741198897361755,0.8931757807731628,Positive,[]
12 de fevereiro de 2023,"Uma boa opção de Mexicano na Barra. Ótimo atendimento,comida de qualidade em um rodízio bastante interessante.",opcao atendimento qualidade rodizio,"Uma boa opcao de Mexicano na Barra. Otimo atendimento,comida de qualidade em um rodizio bastante interessante.",0,0_lugar_atendimento_aniversario_amigo,"['lugar', 'atendimento', 'aniversario', 'amigo', 'ambiente', 'funcionario', 'certeza', 'vez', 'familia', 'casa']","['lugar decoracao atendimento lugar amigo familia', 'atendimento garcons lugar amigo lugar aniversario', 'lugar atendimento aniversario amigo']",0.9531365036964417,0.025531165301799774,0.021332301199436188,0.9531365036964417,Positive,"[('Mexican', 'I-MISC'), ('Barra', 'I-LOC')]"
8 de fevereiro de 2023,"Excelente atendimento, comida maravilhosa, lugar muito lindo e animado, ótimo lugar para fazer aniversário!",atendimento lugar lugar aniversario,"Excelente atendimento, comida maravilhosa, lugar muito lindo e animado, otimo lugar para fazer aniversario!",0,0_lugar_atendimento_aniversario_amigo,"['lugar', 'atendimento', 'aniversario', 'amigo', 'ambiente', 'funcionario', 'certeza', 'vez', 'familia', 'casa']","['lugar decoracao atendimento lugar amigo familia', 'atendimento garcons lugar amigo lugar aniversario', 'lugar atendimento aniversario amigo']",0.991355836391449,0.00515238381922245,0.003491820767521858,0.991355836391449,Positive,[]
30 de janeiro de 2023,"Ficamos encantados em conhecer pela primeira vez a cozinha  mexicana. Valeu a pena demais conhecer este lugar. Desde os primeiros passos na entrada, o atendimento, o capricho. Tudo perfeito . Voltaremos com certeza .",vez cozinha pena lugar passo entrada atendimento certeza,"Ficamos encantados em conhecer pela primeira vez a cozinha  mexicana. Valeu a pena demais conhecer este lugar. Desde os primeiros passos na entrada, o atendimento, o capricho. Tudo perfeito . Voltaremos com certeza .",0,0_lugar_atendimento_aniversario_amigo,"['lugar', 'atendimento', 'aniversario', 'amigo', 'ambiente', 'funcionario', 'certeza', 'vez', 'familia', 'casa']","['lugar decoracao atendimento lugar amigo familia', 'atendimento garcons lugar amigo lugar aniversario', 'lugar atendimento aniversario amigo']",0.8331953287124634,0.05265536531805992,0.11414934694766998,0.8331953287124634,Positive,"[('mexicana', 'I-MISC')]"
8 de janeiro de 2023,"Alisson é um ótimo funcionário, nos atendeu muito bem e nos proporcionou uma noite muito agradável!.",funcionario noite,"Alisson e um otimo funcionario, nos atendeu muito bem e nos proporcionou uma noite muito agradavel!.",0,0_lugar_atendimento_aniversario_amigo,"['lugar', 'atendimento', 'aniversario', 'amigo', 'ambiente', 'funcionario', 'certeza', 'vez', 'familia', 'casa']","['lugar decoracao atendimento lugar amigo familia', 'atendimento garcons lugar amigo lugar aniversario', 'lugar atendimento aniversario amigo']",0.695427656173706,0.04157973453402519,0.26299259066581726,0.695427656173706,Positive,"[('Alisson', 'I-PER')]"
20 de dezembro de 2022,"Sensacional, atendimento ótimo, muito animado 👏🏻👏🏻👏🏻 visito desce 2015, sempre melhorando cada vez mais!",atendimento vez,"Sensacional, atendimento otimo, muito animado  visito desce 2015, sempre melhorando cada vez mais!",0,0_lugar_atendimento_aniversario_amigo,"['lugar', 'atendimento', 'aniversario', 'amigo', 'ambiente', 'funcionario', 'certeza', 'vez', 'familia', 'casa']","['lugar decoracao atendimento lugar amigo familia', 'atendimento garcons lugar amigo lugar aniversario', 'lugar atendimento aniversario amigo']",0.9556891918182373,0.015211806632578373,0.02909899316728115,0.9556891918182373,Positive,[]
