Date,Review,Review_Topic,Review_Entity,Topics,Names,Representation,Representative_Docs,Positive,Neutral,Negative,Highest Score,Sentiment,Token Predictions Corrected
29 de dezembro de 2019,Muito bom o atendimento é a comida. Arrasaram!! Tudo bom demais. Quero voltar novamente para prestigiar,atendimento,Muito bom o atendimento e a comida. Arrasaram!! Tudo bom demais. Quero voltar novamente para prestigiar,0,0_lugar_atendimento_aniversario_amigo,"['lugar', 'atendimento', 'aniversario', 'amigo', 'ambiente', 'funcionario', 'certeza', 'vez', 'familia', 'casa']","['lugar decoracao atendimento lugar amigo familia', 'atendimento garcons lugar amigo lugar aniversario', 'lugar atendimento aniversario amigo']",0.7375701665878296,0.037060562521219254,0.22536924481391907,0.7375701665878296,Positive,[]
28 de dezembro de 2019,"Muito bom, primeira vez que visito o RJ e foi um dos melhores lugares que vim. Voltarei sempre. Beijos",vez lugar beijo,"Muito bom, primeira vez que visito o RJ e foi um dos melhores lugares que vim. Voltarei sempre. Beijos",0,0_lugar_atendimento_aniversario_amigo,"['lugar', 'atendimento', 'aniversario', 'amigo', 'ambiente', 'funcionario', 'certeza', 'vez', 'familia', 'casa']","['lugar decoracao atendimento lugar amigo familia', 'atendimento garcons lugar amigo lugar aniversario', 'lugar atendimento aniversario amigo']",0.9353743195533752,0.02245641127228737,0.04216928780078888,0.9353743195533752,Positive,"[('<s>', 'I-LOC'), ('RJ</s>', 'I-LOC')]"
28 de dezembro de 2019,"Atendimento rápido, possui o sistema de pedidos eletrônico que facilita muito os pedidos. O ambiente é decorado ao tema mexicano, muito bom!",atendimento sistema pedido pedido tema,"Atendimento rapido, possui o sistema de pedidos eletronico que facilita muito os pedidos. O ambiente e decorado ao tema mexicano, muito bom!",0,0_lugar_atendimento_aniversario_amigo,"['lugar', 'atendimento', 'aniversario', 'amigo', 'ambiente', 'funcionario', 'certeza', 'vez', 'familia', 'casa']","['lugar decoracao atendimento lugar amigo familia', 'atendimento garcons lugar amigo lugar aniversario', 'lugar atendimento aniversario amigo']",0.9855253100395203,0.00729008112102747,0.007184636313468218,0.9855253100395203,Positive,"[('mexicano', 'I-MISC')]"
28 de dezembro de 2019,"Ótimo clima pra curtir com os amigos, comida sempre boa e o lugar animado. Garçom André realizou um ótimo atendimento!",clima amigo lugar garcom atendimento,"Otimo clima pra curtir com os amigos, comida sempre boa e o lugar animado. Garcom Andre realizou um otimo atendimento!",0,0_lugar_atendimento_aniversario_amigo,"['lugar', 'atendimento', 'aniversario', 'amigo', 'ambiente', 'funcionario', 'certeza', 'vez', 'familia', 'casa']","['lugar decoracao atendimento lugar amigo familia', 'atendimento garcons lugar amigo lugar aniversario', 'lugar atendimento aniversario amigo']",0.9202250838279724,0.03420887514948845,0.04556600749492645,0.9202250838279724,Positive,"[('Garcom', 'I-PER'), ('Andre', 'I-PER')]"
28 de dezembro de 2019,Lugar muito bom de se reunir com os amigos e curtir uma noite temática bem diferente!!! Noite top!!!,lugar amigo noite noite,Lugar muito bom de se reunir com os amigos e curtir uma noite tematica bem diferente!!! Noite top!!!,0,0_lugar_atendimento_aniversario_amigo,"['lugar', 'atendimento', 'aniversario', 'amigo', 'ambiente', 'funcionario', 'certeza', 'vez', 'familia', 'casa']","['lugar decoracao atendimento lugar amigo familia', 'atendimento garcons lugar amigo lugar aniversario', 'lugar atendimento aniversario amigo']",0.968169093132019,0.016048796474933624,0.0157821886241436,0.968169093132019,Positive,[]
28 de dezembro de 2019,"Ótimo ambiente, aconchegante . André um excelente garçom e atencioso. Recomendo a quem quer se divertir com amigos",ambiente garcom amigo,"Otimo ambiente, aconchegante . Andre um excelente garcom e atencioso. Recomendo a quem quer se divertir com amigos",0,0_lugar_atendimento_aniversario_amigo,"['lugar', 'atendimento', 'aniversario', 'amigo', 'ambiente', 'funcionario', 'certeza', 'vez', 'familia', 'casa']","['lugar decoracao atendimento lugar amigo familia', 'atendimento garcons lugar amigo lugar aniversario', 'lugar atendimento aniversario amigo']",0.9378620982170105,0.02290390245616436,0.0392339862883091,0.9378620982170105,Positive,"[('Andre', 'I-PER')]"
28 de dezembro de 2019,"Muito bom, organizado, animado e com otimo custo benefício. Interessante vir com amigos e encher a cara até o fechamento.",custo amigo cara,"Muito bom, organizado, animado e com otimo custo beneficio. Interessante vir com amigos e encher a cara ate o fechamento.",0,0_lugar_atendimento_aniversario_amigo,"['lugar', 'atendimento', 'aniversario', 'amigo', 'ambiente', 'funcionario', 'certeza', 'vez', 'familia', 'casa']","['lugar decoracao atendimento lugar amigo familia', 'atendimento garcons lugar amigo lugar aniversario', 'lugar atendimento aniversario amigo']",0.9572696089744568,0.01306120865046978,0.029669227078557014,0.9572696089744568,Positive,[]
26 de dezembro de 2019,"Ótimo atendimento, show de bola ambiente muito legal, pessoas animadas.
Muito legal, Não vão se arrepender.
Vale muito apena",atendimento show pessoa apena,"Otimo atendimento, show de bola ambiente muito legal, pessoas animadas.
Muito legal, Nao vao se arrepender.
Vale muito apena",0,0_lugar_atendimento_aniversario_amigo,"['lugar', 'atendimento', 'aniversario', 'amigo', 'ambiente', 'funcionario', 'certeza', 'vez', 'familia', 'casa']","['lugar decoracao atendimento lugar amigo familia', 'atendimento garcons lugar amigo lugar aniversario', 'lugar atendimento aniversario amigo']",0.6728293895721436,0.10317324846982956,0.2239973247051239,0.6728293895721436,Positive,[]
21 de dezembro de 2019,"Há alguns anos eu resolvi não comemorar mais meu aniversário, mas esse ano resolvi e me indicaram aqui! Até agora está sendo maravilhoso, lugar tranquilo, bom atendimento, e a tecnologia muito legal!",ano aniversario ano lugar atendimento tecnologia,"Ha alguns anos eu resolvi nao comemorar mais meu aniversario, mas esse ano resolvi e me indicaram aqui! Ate agora esta sendo maravilhoso, lugar tranquilo, bom atendimento, e a tecnologia muito legal!",0,0_lugar_atendimento_aniversario_amigo,"['lugar', 'atendimento', 'aniversario', 'amigo', 'ambiente', 'funcionario', 'certeza', 'vez', 'familia', 'casa']","['lugar decoracao atendimento lugar amigo familia', 'atendimento garcons lugar amigo lugar aniversario', 'lugar atendimento aniversario amigo']",0.6172948479652405,0.14737248420715332,0.23533262312412262,0.6172948479652405,Positive,[]
21 de dezembro de 2019,Gostei muito do ambiente e da comida. Bem temperada e o pedido sai bem rápido. O cardápio vem detalhado.,ambiente cardapio,Gostei muito do ambiente e da comida. Bem temperada e o pedido sai bem rapido. O cardapio vem detalhado.,0,0_lugar_atendimento_aniversario_amigo,"['lugar', 'atendimento', 'aniversario', 'amigo', 'ambiente', 'funcionario', 'certeza', 'vez', 'familia', 'casa']","['lugar decoracao atendimento lugar amigo familia', 'atendimento garcons lugar amigo lugar aniversario', 'lugar atendimento aniversario amigo']",0.4228769540786743,0.10995712876319885,0.46716591715812683,0.46716591715812683,Negative,[]
17 de dezembro de 2019,"Ótimo lugar para fazermos confraternização da empresa, aniversários. Ambiente agradável limpo cheiroso.",lugar empresa cheiroso,"Otimo lugar para fazermos confraternizacao da empresa, aniversarios. Ambiente agradavel limpo cheiroso.",0,0_lugar_atendimento_aniversario_amigo,"['lugar', 'atendimento', 'aniversario', 'amigo', 'ambiente', 'funcionario', 'certeza', 'vez', 'familia', 'casa']","['lugar decoracao atendimento lugar amigo familia', 'atendimento garcons lugar amigo lugar aniversario', 'lugar atendimento aniversario amigo']",0.804216742515564,0.052338842302560806,0.14344443380832672,0.804216742515564,Positive,[]
17 de dezembro de 2019,"Ótimo lugar, ambiente agradável. Otimo lugar para reunião com amigos.
Recomendo o lugar para quem busca diversão.",lugar lugar reuniaor lugar diversao,"Otimo lugar, ambiente agradavel. Otimo lugar para reuniao com amigos.
Recomendo o lugar para quem busca diversao.",0,0_lugar_atendimento_aniversario_amigo,"['lugar', 'atendimento', 'aniversario', 'amigo', 'ambiente', 'funcionario', 'certeza', 'vez', 'familia', 'casa']","['lugar decoracao atendimento lugar amigo familia', 'atendimento garcons lugar amigo lugar aniversario', 'lugar atendimento aniversario amigo']",0.9055157899856567,0.03089437633752823,0.06358980387449265,0.9055157899856567,Positive,[]
17 de dezembro de 2019,"ótimo lugar, com uma boa localização, comida maravilhosa e um otimo atendimento. nacho ótimo, ameiii",lugar localizacao atendimento,"otimo lugar, com uma boa localizacao, comida maravilhosa e um otimo atendimento. nacho otimo, ameiii",0,0_lugar_atendimento_aniversario_amigo,"['lugar', 'atendimento', 'aniversario', 'amigo', 'ambiente', 'funcionario', 'certeza', 'vez', 'familia', 'casa']","['lugar decoracao atendimento lugar amigo familia', 'atendimento garcons lugar amigo lugar aniversario', 'lugar atendimento aniversario amigo']",0.9112215638160706,0.034151673316955566,0.0546267069876194,0.9112215638160706,Positive,[]
14 de dezembro de 2019,"Lugar extraordinário,  que todos venham e se sintam em casa. Indico a todas as idades e pessoas do mundo.",lugar casa idade pessoa,"Lugar extraordinario,  que todos venham e se sintam em casa. Indico a todas as idades e pessoas do mundo.",0,0_lugar_atendimento_aniversario_amigo,"['lugar', 'atendimento', 'aniversario', 'amigo', 'ambiente', 'funcionario', 'certeza', 'vez', 'familia', 'casa']","['lugar decoracao atendimento lugar amigo familia', 'atendimento garcons lugar amigo lugar aniversario', 'lugar atendimento aniversario amigo']",0.8152962327003479,0.07987827062606812,0.10482549667358398,0.8152962327003479,Positive,[]
14 de dezembro de 2019,"Recomendo a todos que venham aqui porque a animação é garantida e vai dar tudo certo. Muito bom, Hermanos.",animacao hermano,"Recomendo a todos que venham aqui porque a animacao e garantida e vai dar tudo certo. Muito bom, Hermanos.",0,0_lugar_atendimento_aniversario_amigo,"['lugar', 'atendimento', 'aniversario', 'amigo', 'ambiente', 'funcionario', 'certeza', 'vez', 'familia', 'casa']","['lugar decoracao atendimento lugar amigo familia', 'atendimento garcons lugar amigo lugar aniversario', 'lugar atendimento aniversario amigo']",0.9191391468048096,0.029085658490657806,0.05177515372633934,0.9191391468048096,Positive,"[('Hermanos', 'I-PER')]"
14 de dezembro de 2019,"Primeiramente já cheguei ao som bombástico dos mariachis, e com a melhor companhia dos amigos. Recomendo.",som companhia,"Primeiramente ja cheguei ao som bombastico dos mariachis, e com a melhor companhia dos amigos. Recomendo.",0,0_lugar_atendimento_aniversario_amigo,"['lugar', 'atendimento', 'aniversario', 'amigo', 'ambiente', 'funcionario', 'certeza', 'vez', 'familia', 'casa']","['lugar decoracao atendimento lugar amigo familia', 'atendimento garcons lugar amigo lugar aniversario', 'lugar atendimento aniversario amigo']",0.8630966544151306,0.04426939785480499,0.09263399988412857,0.8630966544151306,Positive,[]
14 de dezembro de 2019,"Muito bom o local e o atendimento!!! Ótima localização, bem no coração da Barra!! Super recomendo a visita!",atendimento localizacao coracao visita,"Muito bom o local e o atendimento!!! Otima localizacao, bem no coracao da Barra!! Super recomendo a visita!",0,0_lugar_atendimento_aniversario_amigo,"['lugar', 'atendimento', 'aniversario', 'amigo', 'ambiente', 'funcionario', 'certeza', 'vez', 'familia', 'casa']","['lugar decoracao atendimento lugar amigo familia', 'atendimento garcons lugar amigo lugar aniversario', 'lugar atendimento aniversario amigo']",0.8544745445251465,0.02104833349585533,0.12447714805603027,0.8544745445251465,Positive,"[('Barra', 'I-LOC')]"
13 de dezembro de 2019,Lugar muito animada para amigo oculto de final de ano entre amigas de verdade!!!!! Venham e curtam!!!,lugar amigo ano amiga verdade,Lugar muito animada para amigo oculto de final de ano entre amigas de verdade!!!!! Venham e curtam!!!,0,0_lugar_atendimento_aniversario_amigo,"['lugar', 'atendimento', 'aniversario', 'amigo', 'ambiente', 'funcionario', 'certeza', 'vez', 'familia', 'casa']","['lugar decoracao atendimento lugar amigo familia', 'atendimento garcons lugar amigo lugar aniversario', 'lugar atendimento aniversario amigo']",0.8013381361961365,0.04004408046603203,0.1586177796125412,0.8013381361961365,Positive,[]
13 de dezembro de 2019,"Super divertido, aproveitando muito com as minhas melhores amigas dessa vida, obrigada Deus... incrivel esse lugar",super amiga vida deus lugar,"Super divertido, aproveitando muito com as minhas melhores amigas dessa vida, obrigada Deus... incrivel esse lugar",0,0_lugar_atendimento_aniversario_amigo,"['lugar', 'atendimento', 'aniversario', 'amigo', 'ambiente', 'funcionario', 'certeza', 'vez', 'familia', 'casa']","['lugar decoracao atendimento lugar amigo familia', 'atendimento garcons lugar amigo lugar aniversario', 'lugar atendimento aniversario amigo']",0.9766984581947327,0.011248785071074963,0.012052715755999088,0.9766984581947327,Positive,"[('Deus', 'I-PER')]"
12 de dezembro de 2019,"eu peço e imploro a todos que venham, pois vão se sentir em casa e tudo aqui trabalha pra isso acontecer.",casa,"eu peco e imploro a todos que venham, pois vao se sentir em casa e tudo aqui trabalha pra isso acontecer.",0,0_lugar_atendimento_aniversario_amigo,"['lugar', 'atendimento', 'aniversario', 'amigo', 'ambiente', 'funcionario', 'certeza', 'vez', 'familia', 'casa']","['lugar decoracao atendimento lugar amigo familia', 'atendimento garcons lugar amigo lugar aniversario', 'lugar atendimento aniversario amigo']",0.06852439790964127,0.04489288479089737,0.8865827322006226,0.8865827322006226,Negative,[]
12 de dezembro de 2019,"Espaço muito bom, clima muito agradável e um ótimo atendimento!! Parece até que estamos no México!!!",espaco clima atendimento,"Espaco muito bom, clima muito agradavel e um otimo atendimento!! Parece ate que estamos no Mexico!!!",0,0_lugar_atendimento_aniversario_amigo,"['lugar', 'atendimento', 'aniversario', 'amigo', 'ambiente', 'funcionario', 'certeza', 'vez', 'familia', 'casa']","['lugar decoracao atendimento lugar amigo familia', 'atendimento garcons lugar amigo lugar aniversario', 'lugar atendimento aniversario amigo']",0.8899565935134888,0.016258329153060913,0.09378504008054733,0.8899565935134888,Positive,"[('Mexico', 'I-LOC')]"
10 de dezembro de 2019,"Adorei o serviço, banda e a comida. A banda é muito divertida. No entanto tive problemas pra chamar o garçom pelo tablet",servico banda banda problema garcom,"Adorei o servico, banda e a comida. A banda e muito divertida. No entanto tive problemas pra chamar o garcom pelo tablet",0,0_lugar_atendimento_aniversario_amigo,"['lugar', 'atendimento', 'aniversario', 'amigo', 'ambiente', 'funcionario', 'certeza', 'vez', 'familia', 'casa']","['lugar decoracao atendimento lugar amigo familia', 'atendimento garcons lugar amigo lugar aniversario', 'lugar atendimento aniversario amigo']",0.8160080313682556,0.10492363572120667,0.0790683701634407,0.8160080313682556,Positive,[]
4 de dezembro de 2019,"Queridos, venho por meio desta declarar meu novo amor por este restaurante que tão bem me alimentou e recebeu. Quem puder vir, que venha e não saia enquanto não se apaixonar.",amor saia,"Queridos, venho por meio desta declarar meu novo amor por este restaurante que tao bem me alimentou e recebeu. Quem puder vir, que venha e nao saia enquanto nao se apaixonar.",0,0_lugar_atendimento_aniversario_amigo,"['lugar', 'atendimento', 'aniversario', 'amigo', 'ambiente', 'funcionario', 'certeza', 'vez', 'familia', 'casa']","['lugar decoracao atendimento lugar amigo familia', 'atendimento garcons lugar amigo lugar aniversario', 'lugar atendimento aniversario amigo']",0.824069082736969,0.06471627205610275,0.11121463030576706,0.824069082736969,Positive,[]
4 de dezembro de 2019,Comemoramos o aniversario de uma amiga no restaurante. Fomos muito bem atendidos. O sistema de pedidos na mesa pelo tablet é muito moderno e facilita bastante. O show dos mariachis foi basrantw divertido com dose de twquila grátis para a aniversariante. Decoração lindíssima! Me senti...Mais,aniversario amigo sistema mesa show basrantw dose decoracao,Comemoramos o aniversario de uma amiga no restaurante. Fomos muito bem atendidos. O sistema de pedidos na mesa pelo tablet e muito moderno e facilita bastante. O show dos mariachis foi basrantw divertido com dose de twquila gratis para a aniversariante. Decoracao lindissima! Me senti...Mais,0,0_lugar_atendimento_aniversario_amigo,"['lugar', 'atendimento', 'aniversario', 'amigo', 'ambiente', 'funcionario', 'certeza', 'vez', 'familia', 'casa']","['lugar decoracao atendimento lugar amigo familia', 'atendimento garcons lugar amigo lugar aniversario', 'lugar atendimento aniversario amigo']",0.9061888456344604,0.035178042948246,0.058633122593164444,0.9061888456344604,Positive,[]
4 de dezembro de 2019,Lugar muito animado! Ótimo atendimento! Comida excelente com a melhor companhia. Recomendo que venham porque o arrependimento passa longe!,lugar atendimento companhia arrependimento,Lugar muito animado! Otimo atendimento! Comida excelente com a melhor companhia. Recomendo que venham porque o arrependimento passa longe!,0,0_lugar_atendimento_aniversario_amigo,"['lugar', 'atendimento', 'aniversario', 'amigo', 'ambiente', 'funcionario', 'certeza', 'vez', 'familia', 'casa']","['lugar decoracao atendimento lugar amigo familia', 'atendimento garcons lugar amigo lugar aniversario', 'lugar atendimento aniversario amigo']",0.9822960495948792,0.00784726906567812,0.009856624528765678,0.9822960495948792,Positive,[]
26 de novembro de 2019,"Saímos bebadas e com o bucho cheio!!!!!!! Cantamos parabéns 5 vezes! Parabéns gaúcho, goiano, mexicano, paranaense e carioca",bucho parabens parabens,"Saimos bebadas e com o bucho cheio!!!!!!! Cantamos parabens 5 vezes! Parabens gaucho, goiano, mexicano, paranaense e carioca",0,0_lugar_atendimento_aniversario_amigo,"['lugar', 'atendimento', 'aniversario', 'amigo', 'ambiente', 'funcionario', 'certeza', 'vez', 'familia', 'casa']","['lugar decoracao atendimento lugar amigo familia', 'atendimento garcons lugar amigo lugar aniversario', 'lugar atendimento aniversario amigo']",0.3984491229057312,0.042201049625873566,0.5593498945236206,0.5593498945236206,Negative,[]
15 de novembro de 2019,"Lugar maravilhoso, atendimento excelente, gostoso de estar e se alimentar também! Venham e se divirtam, vai dar tudo certo.",lugar atendimento,"Lugar maravilhoso, atendimento excelente, gostoso de estar e se alimentar tambem! Venham e se divirtam, vai dar tudo certo.",0,0_lugar_atendimento_aniversario_amigo,"['lugar', 'atendimento', 'aniversario', 'amigo', 'ambiente', 'funcionario', 'certeza', 'vez', 'familia', 'casa']","['lugar decoracao atendimento lugar amigo familia', 'atendimento garcons lugar amigo lugar aniversario', 'lugar atendimento aniversario amigo']",0.9862408638000488,0.008859722875058651,0.004899326246231794,0.9862408638000488,Positive,[]
6 de novembro de 2019,"Vim numa real viagem ao México, na qual comi e bebi e me diverti e quero voltar. Gente, sem dúvidas o melhor!",viagem gente duvida,"Vim numa real viagem ao Mexico, na qual comi e bebi e me diverti e quero voltar. Gente, sem duvidas o melhor!",0,0_lugar_atendimento_aniversario_amigo,"['lugar', 'atendimento', 'aniversario', 'amigo', 'ambiente', 'funcionario', 'certeza', 'vez', 'familia', 'casa']","['lugar decoracao atendimento lugar amigo familia', 'atendimento garcons lugar amigo lugar aniversario', 'lugar atendimento aniversario amigo']",0.8933669924736023,0.05503345653414726,0.051599521189928055,0.8933669924736023,Positive,"[('Mexico', 'I-LOC')]"
6 de novembro de 2019,"Ambiente aconchegante, agradavel, divertida e eclética. Você pode ir com a família, amigos ou encontro.",ambiente familia encontro,"Ambiente aconchegante, agradavel, divertida e ecletica. Voce pode ir com a familia, amigos ou encontro.",0,0_lugar_atendimento_aniversario_amigo,"['lugar', 'atendimento', 'aniversario', 'amigo', 'ambiente', 'funcionario', 'certeza', 'vez', 'familia', 'casa']","['lugar decoracao atendimento lugar amigo familia', 'atendimento garcons lugar amigo lugar aniversario', 'lugar atendimento aniversario amigo']",0.9557589888572693,0.028288908302783966,0.01595206744968891,0.9557589888572693,Positive,[]
5 de novembro de 2019,Excelente ambiente. Comida com orecos jistos. Os Mariates são muito animados.Misocas maravilhosas. Nota dez.,ambiente notar,Excelente ambiente. Comida com orecos jistos. Os Mariates sao muito animados.Misocas maravilhosas. Nota dez.,0,0_lugar_atendimento_aniversario_amigo,"['lugar', 'atendimento', 'aniversario', 'amigo', 'ambiente', 'funcionario', 'certeza', 'vez', 'familia', 'casa']","['lugar decoracao atendimento lugar amigo familia', 'atendimento garcons lugar amigo lugar aniversario', 'lugar atendimento aniversario amigo']",0.9698905944824219,0.016825223341584206,0.013284143060445786,0.9698905944824219,Positive,"[('Maria', 'I-MISC')]"
5 de novembro de 2019,"Local excelente para uma confraternização com amigis, bom atendimento e pessoas agradáveis. Os coquetéis sao bem sugestivos.",local amigis atendimento pessoa coquetel,"Local excelente para uma confraternizacao com amigis, bom atendimento e pessoas agradaveis. Os coqueteis sao bem sugestivos.",0,0_lugar_atendimento_aniversario_amigo,"['lugar', 'atendimento', 'aniversario', 'amigo', 'ambiente', 'funcionario', 'certeza', 'vez', 'familia', 'casa']","['lugar decoracao atendimento lugar amigo familia', 'atendimento garcons lugar amigo lugar aniversario', 'lugar atendimento aniversario amigo']",0.9773839712142944,0.013194644823670387,0.009421383030712605,0.9773839712142944,Positive,[]
5 de novembro de 2019,"Lugar amplo, mas normalmente tem fila na porta. Fazer reserva ou chegar cedo são as opções. Cardápio com boa variedade dentro da culinária mexicana. Decoração alegre e intervenções de mariachis",lugar filar reserva opcao cardapio variedade culinaria decoracao intervencao,"Lugar amplo, mas normalmente tem fila na porta. Fazer reserva ou chegar cedo sao as opcoes. Cardapio com boa variedade dentro da culinaria mexicana. Decoracao alegre e intervencoes de mariachis",0,0_lugar_atendimento_aniversario_amigo,"['lugar', 'atendimento', 'aniversario', 'amigo', 'ambiente', 'funcionario', 'certeza', 'vez', 'familia', 'casa']","['lugar decoracao atendimento lugar amigo familia', 'atendimento garcons lugar amigo lugar aniversario', 'lugar atendimento aniversario amigo']",0.69579017162323,0.11991710960865021,0.184292733669281,0.69579017162323,Positive,"[('mexicana', 'I-MISC')]"
30 de outubro de 2019,"Mano, surpreendentemente bom. Pedi uma recomendação e ganhei uma festa! Graças a Deus, saindo bem alimentado e bem entretido.",mano recomendacao festa deus,"Mano, surpreendentemente bom. Pedi uma recomendacao e ganhei uma festa! Gracas a Deus, saindo bem alimentado e bem entretido.",0,0_lugar_atendimento_aniversario_amigo,"['lugar', 'atendimento', 'aniversario', 'amigo', 'ambiente', 'funcionario', 'certeza', 'vez', 'familia', 'casa']","['lugar decoracao atendimento lugar amigo familia', 'atendimento garcons lugar amigo lugar aniversario', 'lugar atendimento aniversario amigo']",0.9563896059989929,0.014066498726606369,0.029543915763497353,0.9563896059989929,Positive,"[('Deus', 'I-PER')]"
25 de outubro de 2019,"Super recomendo! Todos que passarem pelo Rio devem visitar a casa! 
O André é maravilhoso! Peçam pra serem atendidos por ele",super rio casa,"Super recomendo! Todos que passarem pelo Rio devem visitar a casa! 
O Andre e maravilhoso! Pecam pra serem atendidos por ele",0,0_lugar_atendimento_aniversario_amigo,"['lugar', 'atendimento', 'aniversario', 'amigo', 'ambiente', 'funcionario', 'certeza', 'vez', 'familia', 'casa']","['lugar decoracao atendimento lugar amigo familia', 'atendimento garcons lugar amigo lugar aniversario', 'lugar atendimento aniversario amigo']",0.9798723459243774,0.010109074413776398,0.010018550790846348,0.9798723459243774,Positive,"[('Rio', 'I-LOC'), ('Andre', 'I-PER')]"
23 de outubro de 2019,"Maravilha grande estar neste lugar assistindo um jogão do Fla. Dica: todas as vezes que quiserem sair da rotina, venham a este lugar, independentemente da ocasião.",maravilha lugar jogao vez rotina lugar ocasiao,"Maravilha grande estar neste lugar assistindo um jogao do Fla. Dica: todas as vezes que quiserem sair da rotina, venham a este lugar, independentemente da ocasiao.",0,0_lugar_atendimento_aniversario_amigo,"['lugar', 'atendimento', 'aniversario', 'amigo', 'ambiente', 'funcionario', 'certeza', 'vez', 'familia', 'casa']","['lugar decoracao atendimento lugar amigo familia', 'atendimento garcons lugar amigo lugar aniversario', 'lugar atendimento aniversario amigo']",0.7593803405761719,0.10634493082761765,0.13427472114562988,0.7593803405761719,Positive,"[('Fla', 'I-ORG')]"
23 de outubro de 2019,Fizemos um happy hour no Guacamole para assistir o jogo do Flamengo e Grêmio! Fomos muito bem atendidos e eles souberam nos cativar! Voltaremos com certeza!,jogo certeza,Fizemos um happy hour no Guacamole para assistir o jogo do Flamengo e Gremio! Fomos muito bem atendidos e eles souberam nos cativar! Voltaremos com certeza!,0,0_lugar_atendimento_aniversario_amigo,"['lugar', 'atendimento', 'aniversario', 'amigo', 'ambiente', 'funcionario', 'certeza', 'vez', 'familia', 'casa']","['lugar decoracao atendimento lugar amigo familia', 'atendimento garcons lugar amigo lugar aniversario', 'lugar atendimento aniversario amigo']",0.9616082906723022,0.01413858775049448,0.02425316907465458,0.9616082906723022,Positive,"[('Guacamole', 'I-LOC'), ('Flamengo', 'I-ORG'), ('Gremio', 'I-ORG')]"
