Date,Review,Review_Topic,Review_Entity,Topics,Names,Representation,Representative_Docs,Positive,Neutral,Negative,Highest Score,Sentiment,Token Predictions Corrected
1 de junho de 2019,"Minha primeira vez na casa, comida maravilhosa, ótimo atendimento e música muito boa. Voltarei com certeza!",vez casa atendimento certeza,"Minha primeira vez na casa, comida maravilhosa, otimo atendimento e musica muito boa. Voltarei com certeza!",0,0_lugar_atendimento_aniversario_amigo,"['lugar', 'atendimento', 'aniversario', 'amigo', 'ambiente', 'funcionario', 'certeza', 'vez', 'familia', 'casa']","['lugar decoracao atendimento lugar amigo familia', 'atendimento garcons lugar amigo lugar aniversario', 'lugar atendimento aniversario amigo']",0.9843078255653381,0.008054438047111034,0.007637687027454376,0.9843078255653381,Positive,[]
1 de junho de 2019,"Atendimento de qualidade e a comida é ótima também, fora a animação do ambiente, excelente lugar para distração com amigos!",atendimento qualidade animacao lugar distracao,"Atendimento de qualidade e a comida e otima tambem, fora a animacao do ambiente, excelente lugar para distracao com amigos!",0,0_lugar_atendimento_aniversario_amigo,"['lugar', 'atendimento', 'aniversario', 'amigo', 'ambiente', 'funcionario', 'certeza', 'vez', 'familia', 'casa']","['lugar decoracao atendimento lugar amigo familia', 'atendimento garcons lugar amigo lugar aniversario', 'lugar atendimento aniversario amigo']",0.9661535620689392,0.020994756370782852,0.012851620092988014,0.9661535620689392,Positive,[]
1 de junho de 2019,"Comemorando meu aniversário, ótimo atendimento e ótimo lugar, comida muito boa e climatização especial",aniversario atendimento lugar climatizacao,"Comemorando meu aniversario, otimo atendimento e otimo lugar, comida muito boa e climatizacao especial",0,0_lugar_atendimento_aniversario_amigo,"['lugar', 'atendimento', 'aniversario', 'amigo', 'ambiente', 'funcionario', 'certeza', 'vez', 'familia', 'casa']","['lugar decoracao atendimento lugar amigo familia', 'atendimento garcons lugar amigo lugar aniversario', 'lugar atendimento aniversario amigo']",0.9444065690040588,0.020998500287532806,0.03459496051073074,0.9444065690040588,Positive,[]
31 de maio de 2019,"Uma experiência maravilhosa, onde todos se divertem com muita alegria. Venham visitar que não irão se arrepender.",experiencia alegria,"Uma experiencia maravilhosa, onde todos se divertem com muita alegria. Venham visitar que nao irao se arrepender.",0,0_lugar_atendimento_aniversario_amigo,"['lugar', 'atendimento', 'aniversario', 'amigo', 'ambiente', 'funcionario', 'certeza', 'vez', 'familia', 'casa']","['lugar decoracao atendimento lugar amigo familia', 'atendimento garcons lugar amigo lugar aniversario', 'lugar atendimento aniversario amigo']",0.9186293482780457,0.04324214532971382,0.03812859579920769,0.9186293482780457,Positive,[]
25 de maio de 2019,Tu chega aqui de boa estacionado estaciona o carro na calçada suborno o trocador aí tu chega dentro do estabelecimento é recebido da melhor forma possível por todos os mariachis e os tequileiro o cara é muito gente fina segue em anexo uma foto da...Mais,carro trocador estabelecimento forma tequileiro gente anexo foto,Tu chega aqui de boa estacionado estaciona o carro na calcada suborno o trocador ai tu chega dentro do estabelecimento e recebido da melhor forma possivel por todos os mariachis e os tequileiro o cara e muito gente fina segue em anexo uma foto da...Mais,0,0_lugar_atendimento_aniversario_amigo,"['lugar', 'atendimento', 'aniversario', 'amigo', 'ambiente', 'funcionario', 'certeza', 'vez', 'familia', 'casa']","['lugar decoracao atendimento lugar amigo familia', 'atendimento garcons lugar amigo lugar aniversario', 'lugar atendimento aniversario amigo']",0.7749669551849365,0.06273192167282104,0.16230109333992004,0.7749669551849365,Positive,[]
25 de maio de 2019,"Não tenho palavras para descrever como vocês foram importante nesse noite maravilhosa, obrigado a todos!!!!!!!!!",palavra importante noite,"Nao tenho palavras para descrever como voces foram importante nesse noite maravilhosa, obrigado a todos!!!!!!!!!",0,0_lugar_atendimento_aniversario_amigo,"['lugar', 'atendimento', 'aniversario', 'amigo', 'ambiente', 'funcionario', 'certeza', 'vez', 'familia', 'casa']","['lugar decoracao atendimento lugar amigo familia', 'atendimento garcons lugar amigo lugar aniversario', 'lugar atendimento aniversario amigo']",0.7324531674385071,0.11809180676937103,0.1494549810886383,0.7324531674385071,Positive,[]
25 de maio de 2019,"Ótimo ambiente , despojado, com diversas interações , equipe bem ambientada e otima gestao, ressaltando o atendimento na mesa .",ambiente interacao equipe Gestao atendimento,"Otimo ambiente , despojado, com diversas interacoes , equipe bem ambientada e otima gestao, ressaltando o atendimento na mesa .",0,0_lugar_atendimento_aniversario_amigo,"['lugar', 'atendimento', 'aniversario', 'amigo', 'ambiente', 'funcionario', 'certeza', 'vez', 'familia', 'casa']","['lugar decoracao atendimento lugar amigo familia', 'atendimento garcons lugar amigo lugar aniversario', 'lugar atendimento aniversario amigo']",0.6242219805717468,0.0798865556716919,0.29589149355888367,0.6242219805717468,Positive,[]
25 de maio de 2019,"Extremamente divertido, ambiente descontraido. Bom para levar os amigos e familiares. Ótimo lugar para uma sexta a noite",ambiente amigo lugar noite,"Extremamente divertido, ambiente descontraido. Bom para levar os amigos e familiares. Otimo lugar para uma sexta a noite",0,0_lugar_atendimento_aniversario_amigo,"['lugar', 'atendimento', 'aniversario', 'amigo', 'ambiente', 'funcionario', 'certeza', 'vez', 'familia', 'casa']","['lugar decoracao atendimento lugar amigo familia', 'atendimento garcons lugar amigo lugar aniversario', 'lugar atendimento aniversario amigo']",0.4758853316307068,0.07632759213447571,0.44778698682785034,0.4758853316307068,Positive,[]
24 de maio de 2019,"Ele trapo é o melhor tequillero de todos. Bonito, estiloso, animado, canta bem e atencioso. Pacote completo.",trapo tequillero pacote,"Ele trapo e o melhor tequillero de todos. Bonito, estiloso, animado, canta bem e atencioso. Pacote completo.",0,0_lugar_atendimento_aniversario_amigo,"['lugar', 'atendimento', 'aniversario', 'amigo', 'ambiente', 'funcionario', 'certeza', 'vez', 'familia', 'casa']","['lugar decoracao atendimento lugar amigo familia', 'atendimento garcons lugar amigo lugar aniversario', 'lugar atendimento aniversario amigo']",0.984767735004425,0.010866641066968441,0.004365631379187107,0.984767735004425,Positive,[]
21 de maio de 2019,Nota 10!!!! Maravilhoso!!!! -atendimento nota 10 ambiente maravilhoso!!!! Curso muda maravilhosa!!!! Comemoração nota 10!!!,nota atendimento curso comemoracao,Nota 10!!!! Maravilhoso!!!! -atendimento nota 10 ambiente maravilhoso!!!! Curso muda maravilhosa!!!! Comemoracao nota 10!!!,0,0_lugar_atendimento_aniversario_amigo,"['lugar', 'atendimento', 'aniversario', 'amigo', 'ambiente', 'funcionario', 'certeza', 'vez', 'familia', 'casa']","['lugar decoracao atendimento lugar amigo familia', 'atendimento garcons lugar amigo lugar aniversario', 'lugar atendimento aniversario amigo']",0.9816445112228394,0.009222307242453098,0.009133150801062584,0.9816445112228394,Positive,[]
18 de maio de 2019,"Jorge o melhor garçom

Comida ótima!!! rapidez no atendimento!!! . Local muito bom!!!!

Jorge o melhor

Jorge o melhor",garcom rapidez atendimento,"Jorge o melhor garcom

Comida otima!!! rapidez no atendimento!!! . Local muito bom!!!!

Jorge o melhor

Jorge o melhor",0,0_lugar_atendimento_aniversario_amigo,"['lugar', 'atendimento', 'aniversario', 'amigo', 'ambiente', 'funcionario', 'certeza', 'vez', 'familia', 'casa']","['lugar decoracao atendimento lugar amigo familia', 'atendimento garcons lugar amigo lugar aniversario', 'lugar atendimento aniversario amigo']",0.9759182929992676,0.01087491400539875,0.013206918723881245,0.9759182929992676,Positive,"[('Jorge', 'I-PER'), ('Jorge', 'I-PER'), ('Jorge', 'I-PER')]"
17 de maio de 2019,"Otimo, tudo lindo! Funcionarios incriveis! Pretendo voltar. Evaline, el trapo e alisson merecem um aumento",funcionario trapo aumento,"Otimo, tudo lindo! Funcionarios incriveis! Pretendo voltar. Evaline, el trapo e alisson merecem um aumento",0,0_lugar_atendimento_aniversario_amigo,"['lugar', 'atendimento', 'aniversario', 'amigo', 'ambiente', 'funcionario', 'certeza', 'vez', 'familia', 'casa']","['lugar decoracao atendimento lugar amigo familia', 'atendimento garcons lugar amigo lugar aniversario', 'lugar atendimento aniversario amigo']",0.8899152278900146,0.03137923777103424,0.07870550453662872,0.8899152278900146,Positive,"[('Evaline', 'I-PER'), ('el', 'I-PER'), ('trapo', 'I-PER'), ('alisson', 'I-PER')]"
17 de maio de 2019,"Muito animado o local, o serviço é excelente e com certeza recomendarei a mais pessoas e voltarei!!!
Foi maravilhoso comemorar aqui.",servico certeza pessoa,"Muito animado o local, o servico e excelente e com certeza recomendarei a mais pessoas e voltarei!!!
Foi maravilhoso comemorar aqui.",0,0_lugar_atendimento_aniversario_amigo,"['lugar', 'atendimento', 'aniversario', 'amigo', 'ambiente', 'funcionario', 'certeza', 'vez', 'familia', 'casa']","['lugar decoracao atendimento lugar amigo familia', 'atendimento garcons lugar amigo lugar aniversario', 'lugar atendimento aniversario amigo']",0.9910956621170044,0.004740994889289141,0.004163277335464954,0.9910956621170044,Positive,[]
17 de maio de 2019,"Muito brabo demais ahahhahhaha vai é bom demais, fiquei doidão ahahhAhaha pertinente estou cmt feliz nessa droga. ALLISIN É bom",droga,"Muito brabo demais ahahhahhaha vai e bom demais, fiquei doidao ahahhAhaha pertinente estou cmt feliz nessa droga. ALLISIN E bom",0,0_lugar_atendimento_aniversario_amigo,"['lugar', 'atendimento', 'aniversario', 'amigo', 'ambiente', 'funcionario', 'certeza', 'vez', 'familia', 'casa']","['lugar decoracao atendimento lugar amigo familia', 'atendimento garcons lugar amigo lugar aniversario', 'lugar atendimento aniversario amigo']",0.8837665915489197,0.04295852780342102,0.07327494770288467,0.8837665915489197,Positive,"[('<s>', 'I-MISC'), ('ALLISIN</s>', 'I-MISC')]"
17 de maio de 2019,Amei esse lugar... levo sempre meus amigos para comemorações ... muito descontraído e muito animado... ótimo p sair com os amigos e deixar os problemas de lado...Eveline atendente maravilhosa,lugar comemoracao amigo problema lado atendente,Amei esse lugar... levo sempre meus amigos para comemoracoes ... muito descontraido e muito animado... otimo p sair com os amigos e deixar os problemas de lado...Eveline atendente maravilhosa,0,0_lugar_atendimento_aniversario_amigo,"['lugar', 'atendimento', 'aniversario', 'amigo', 'ambiente', 'funcionario', 'certeza', 'vez', 'familia', 'casa']","['lugar decoracao atendimento lugar amigo familia', 'atendimento garcons lugar amigo lugar aniversario', 'lugar atendimento aniversario amigo']",0.6123854517936707,0.05450035631656647,0.33311423659324646,0.6123854517936707,Positive,"[('Eveline', 'I-PER')]"
17 de maio de 2019,"Noite excelente,  nesse lugar maravilhoso!
Atendimento nota 1000, os requileiros não massa! O Dj é ótimo! As comidinhas são deliciosas!",noite lugar atendimento massar comidinha,"Noite excelente,  nesse lugar maravilhoso!
Atendimento nota 1000, os requileiros nao massa! O Dj e otimo! As comidinhas sao deliciosas!",0,0_lugar_atendimento_aniversario_amigo,"['lugar', 'atendimento', 'aniversario', 'amigo', 'ambiente', 'funcionario', 'certeza', 'vez', 'familia', 'casa']","['lugar decoracao atendimento lugar amigo familia', 'atendimento garcons lugar amigo lugar aniversario', 'lugar atendimento aniversario amigo']",0.9513079524040222,0.021836217492818832,0.02685578353703022,0.9513079524040222,Positive,[]
17 de maio de 2019,"Perfeito para encontro c amigos, comemorações..
Ambiente maravilhoso, bem localizado, descontraído , atendentes maravilhosos principalmente Allan nosso garçom ..equipe de animação showwwww

Minha primeira vez ..virei sempre amei esse lugar ...",encontro comemoracao ambiente atendente animacao vez lugar,"Perfeito para encontro c amigos, comemoracoes..
Ambiente maravilhoso, bem localizado, descontraido , atendentes maravilhosos principalmente Allan nosso garcom ..equipe de animacao showwwww

Minha primeira vez ..virei sempre amei esse lugar ...",0,0_lugar_atendimento_aniversario_amigo,"['lugar', 'atendimento', 'aniversario', 'amigo', 'ambiente', 'funcionario', 'certeza', 'vez', 'familia', 'casa']","['lugar decoracao atendimento lugar amigo familia', 'atendimento garcons lugar amigo lugar aniversario', 'lugar atendimento aniversario amigo']",0.8964362144470215,0.032931890338659286,0.07063186913728714,0.8964362144470215,Positive,"[('Allan', 'I-PER')]"
16 de maio de 2019,"Otimo, ambiente agradável, super divertido, um ambiente para amigos e família! 
Super recomendo! 
Um prazer",ambiente ambiente amigo familia prazer,"Otimo, ambiente agradavel, super divertido, um ambiente para amigos e familia! 
Super recomendo! 
Um prazer",0,0_lugar_atendimento_aniversario_amigo,"['lugar', 'atendimento', 'aniversario', 'amigo', 'ambiente', 'funcionario', 'certeza', 'vez', 'familia', 'casa']","['lugar decoracao atendimento lugar amigo familia', 'atendimento garcons lugar amigo lugar aniversario', 'lugar atendimento aniversario amigo']",0.9860710501670837,0.007181636057794094,0.006747249513864517,0.9860710501670837,Positive,[]
16 de maio de 2019,"Excelente atendimento, comida e principalmente o clima festivo. 
Funcionários animados e gentis. Vale muito a visita!",atendimento clima funcionario gentis visita,"Excelente atendimento, comida e principalmente o clima festivo. 
Funcionarios animados e gentis. Vale muito a visita!",0,0_lugar_atendimento_aniversario_amigo,"['lugar', 'atendimento', 'aniversario', 'amigo', 'ambiente', 'funcionario', 'certeza', 'vez', 'familia', 'casa']","['lugar decoracao atendimento lugar amigo familia', 'atendimento garcons lugar amigo lugar aniversario', 'lugar atendimento aniversario amigo']",0.9694364070892334,0.020372698083519936,0.010190851986408234,0.9694364070892334,Positive,[]
15 de maio de 2019,"O couvert artístico poderia ser opcional, mas o atendimento pelo Tablet é bem prático e funcional...",couvert atendimento,"O couvert artistico poderia ser opcional, mas o atendimento pelo Tablet e bem pratico e funcional...",0,0_lugar_atendimento_aniversario_amigo,"['lugar', 'atendimento', 'aniversario', 'amigo', 'ambiente', 'funcionario', 'certeza', 'vez', 'familia', 'casa']","['lugar decoracao atendimento lugar amigo familia', 'atendimento garcons lugar amigo lugar aniversario', 'lugar atendimento aniversario amigo']",0.44937923550605774,0.23378625512123108,0.31683453917503357,0.44937923550605774,Positive,[]
14 de maio de 2019,"Mito animado, bom atendimento, rapido entrega do pedido, acho de deveriam ampliar horario do desconto de 50% da nebida pata as 21hs.",mito atendimento horario pata hs,"Mito animado, bom atendimento, rapido entrega do pedido, acho de deveriam ampliar horario do desconto de 50% da nebida pata as 21hs.",0,0_lugar_atendimento_aniversario_amigo,"['lugar', 'atendimento', 'aniversario', 'amigo', 'ambiente', 'funcionario', 'certeza', 'vez', 'familia', 'casa']","['lugar decoracao atendimento lugar amigo familia', 'atendimento garcons lugar amigo lugar aniversario', 'lugar atendimento aniversario amigo']",0.9073267579078674,0.020410189405083656,0.07226299494504929,0.9073267579078674,Positive,[]
12 de maio de 2019,Ótimo  ambiente atendimento  excelente perfeito para curtir uma noite com os amigos ou ao lado do seu companheiro,atendimento noite lado companheiro,Otimo  ambiente atendimento  excelente perfeito para curtir uma noite com os amigos ou ao lado do seu companheiro,0,0_lugar_atendimento_aniversario_amigo,"['lugar', 'atendimento', 'aniversario', 'amigo', 'ambiente', 'funcionario', 'certeza', 'vez', 'familia', 'casa']","['lugar decoracao atendimento lugar amigo familia', 'atendimento garcons lugar amigo lugar aniversario', 'lugar atendimento aniversario amigo']",0.8473494052886963,0.04220176860690117,0.11044884473085403,0.8473494052886963,Positive,[]
12 de maio de 2019,"Muito bom, excelente, garçonete  Eveline me atendeu super bem, o garçom  Jonathan a mesma coisa, o tequelilheiro também,  ambiente  super bacana , maravilhoso aconselho  a todos a vim. Amo esse lugar .",garconete super garcom jonathan coisa ambiente aconselho lugar,"Muito bom, excelente, garconete  Eveline me atendeu super bem, o garcom  Jonathan a mesma coisa, o tequelilheiro tambem,  ambiente  super bacana , maravilhoso aconselho  a todos a vim. Amo esse lugar .",0,0_lugar_atendimento_aniversario_amigo,"['lugar', 'atendimento', 'aniversario', 'amigo', 'ambiente', 'funcionario', 'certeza', 'vez', 'familia', 'casa']","['lugar decoracao atendimento lugar amigo familia', 'atendimento garcons lugar amigo lugar aniversario', 'lugar atendimento aniversario amigo']",0.9847984910011292,0.00775048416107893,0.007451129145920277,0.9847984910011292,Positive,"[('Eveline', 'I-PER'), ('Jonathan', 'I-PER')]"
12 de maio de 2019,um lugar muito agradável onde eu trouxe meus amigos pra comemorar meu aniversário e bebemos a noite toda. Ótimo atendimento!,lugar amigo aniversario noite atendimento,um lugar muito agradavel onde eu trouxe meus amigos pra comemorar meu aniversario e bebemos a noite toda. Otimo atendimento!,0,0_lugar_atendimento_aniversario_amigo,"['lugar', 'atendimento', 'aniversario', 'amigo', 'ambiente', 'funcionario', 'certeza', 'vez', 'familia', 'casa']","['lugar decoracao atendimento lugar amigo familia', 'atendimento garcons lugar amigo lugar aniversario', 'lugar atendimento aniversario amigo']",0.5581412315368652,0.03560366854071617,0.4062551259994507,0.5581412315368652,Positive,[]
12 de maio de 2019,Decidi comemorar meu aniversário de última hora e fui muito bem recebido.  Comida de qualidade. Todos muito animados.,aniversario hora qualidade,Decidi comemorar meu aniversario de ultima hora e fui muito bem recebido.  Comida de qualidade. Todos muito animados.,0,0_lugar_atendimento_aniversario_amigo,"['lugar', 'atendimento', 'aniversario', 'amigo', 'ambiente', 'funcionario', 'certeza', 'vez', 'familia', 'casa']","['lugar decoracao atendimento lugar amigo familia', 'atendimento garcons lugar amigo lugar aniversario', 'lugar atendimento aniversario amigo']",0.968295156955719,0.016004478558897972,0.015700366348028183,0.968295156955719,Positive,[]
12 de maio de 2019,"É um ambiente muito animado e alegre. Um ótimo lugar pra se comemorar aniversário.
Tudo que comi e bebi tava ótimo.
Super recomendo!",ambiente alegre lugar aniversario super,"E um ambiente muito animado e alegre. Um otimo lugar pra se comemorar aniversario.
Tudo que comi e bebi tava otimo.
Super recomendo!",0,0_lugar_atendimento_aniversario_amigo,"['lugar', 'atendimento', 'aniversario', 'amigo', 'ambiente', 'funcionario', 'certeza', 'vez', 'familia', 'casa']","['lugar decoracao atendimento lugar amigo familia', 'atendimento garcons lugar amigo lugar aniversario', 'lugar atendimento aniversario amigo']",0.9754691123962402,0.012930778786540031,0.011600176803767681,0.9754691123962402,Positive,[]
8 de maio de 2019,"Adorei o local. Decoração, comida, ambiente, atendentes, tudo perfeito. Fui comemorar o aniversário de uma amiga. Vale conferir.",decoracao aniversario amiga,"Adorei o local. Decoracao, comida, ambiente, atendentes, tudo perfeito. Fui comemorar o aniversario de uma amiga. Vale conferir.",0,0_lugar_atendimento_aniversario_amigo,"['lugar', 'atendimento', 'aniversario', 'amigo', 'ambiente', 'funcionario', 'certeza', 'vez', 'familia', 'casa']","['lugar decoracao atendimento lugar amigo familia', 'atendimento garcons lugar amigo lugar aniversario', 'lugar atendimento aniversario amigo']",0.8156391978263855,0.04104223847389221,0.1433185487985611,0.8156391978263855,Positive,[]
8 de maio de 2019,"Estive com um grupo de amigos (13 para ser exato),para aniversário de uma das. Fomos na recepção, e a atendente informou que não faziam reservas aos fins de semana (era sábado), e que era difícil alocar um número grande, mas seríamos chamados. Vimos várias pessoas...Mais",grupo aniversario recepcaor reserva fim sabado numero pessoa,"Estive com um grupo de amigos (13 para ser exato),para aniversario de uma das. Fomos na recepcao, e a atendente informou que nao faziam reservas aos fins de semana (era sabado), e que era dificil alocar um numero grande, mas seriamos chamados. Vimos varias pessoas...Mais",0,0_lugar_atendimento_aniversario_amigo,"['lugar', 'atendimento', 'aniversario', 'amigo', 'ambiente', 'funcionario', 'certeza', 'vez', 'familia', 'casa']","['lugar decoracao atendimento lugar amigo familia', 'atendimento garcons lugar amigo lugar aniversario', 'lugar atendimento aniversario amigo']",0.39903485774993896,0.21961863338947296,0.38134652376174927,0.39903485774993896,Positive,[]
7 de maio de 2019,"Ótimo lugar para comemorações!! O ambiente é super divertido, a animação dos cantores que vão até à mesa é inesquecível. Vale a pena conhecer!!!",lugar comemoracao animacao mesa pena,"Otimo lugar para comemoracoes!! O ambiente e super divertido, a animacao dos cantores que vao ate a mesa e inesquecivel. Vale a pena conhecer!!!",0,0_lugar_atendimento_aniversario_amigo,"['lugar', 'atendimento', 'aniversario', 'amigo', 'ambiente', 'funcionario', 'certeza', 'vez', 'familia', 'casa']","['lugar decoracao atendimento lugar amigo familia', 'atendimento garcons lugar amigo lugar aniversario', 'lugar atendimento aniversario amigo']",0.890676736831665,0.018459290266036987,0.09086398780345917,0.890676736831665,Positive,[]
7 de maio de 2019,"Lugar com comida de qualidade e ótima para qualquer evento,  com amigos, festas de aniversário ou com a família. Obs. os mariatis são cobrados (couvert artistico)",lugar qualidade evento festa aniversario obs mariati couvert,"Lugar com comida de qualidade e otima para qualquer evento,  com amigos, festas de aniversario ou com a familia. Obs. os mariatis sao cobrados (couvert artistico)",0,0_lugar_atendimento_aniversario_amigo,"['lugar', 'atendimento', 'aniversario', 'amigo', 'ambiente', 'funcionario', 'certeza', 'vez', 'familia', 'casa']","['lugar decoracao atendimento lugar amigo familia', 'atendimento garcons lugar amigo lugar aniversario', 'lugar atendimento aniversario amigo']",0.8357663154602051,0.077879898250103,0.08635372668504715,0.8357663154602051,Positive,[]
6 de maio de 2019,"Perfeito atendimento!  inovação em tecnologia e gestão! funcionarios simpaticos! 
até então, perfeito! sou de T.I e admiro empreendedorismo.",atendimento inovacao tecnologio gestao funcionario,"Perfeito atendimento!  inovacao em tecnologia e gestao! funcionarios simpaticos! 
ate entao, perfeito! sou de T.I e admiro empreendedorismo.",0,0_lugar_atendimento_aniversario_amigo,"['lugar', 'atendimento', 'aniversario', 'amigo', 'ambiente', 'funcionario', 'certeza', 'vez', 'familia', 'casa']","['lugar decoracao atendimento lugar amigo familia', 'atendimento garcons lugar amigo lugar aniversario', 'lugar atendimento aniversario amigo']",0.617965817451477,0.03254535049200058,0.34948885440826416,0.617965817451477,Positive,"[('I', 'I-ORG')]"
4 de maio de 2019,"Lugar excelente, super mega sensacional, muito animado e otimo para datas comemorativas. Com certeza virei mais vezes!",lugar super data certeza vez,"Lugar excelente, super mega sensacional, muito animado e otimo para datas comemorativas. Com certeza virei mais vezes!",0,0_lugar_atendimento_aniversario_amigo,"['lugar', 'atendimento', 'aniversario', 'amigo', 'ambiente', 'funcionario', 'certeza', 'vez', 'familia', 'casa']","['lugar decoracao atendimento lugar amigo familia', 'atendimento garcons lugar amigo lugar aniversario', 'lugar atendimento aniversario amigo']",0.9897955060005188,0.005175457801669836,0.005029086954891682,0.9897955060005188,Positive,[]
4 de maio de 2019,Já viemos outras vezes e sempre excelente com atendimento excelente. Casa muito boa para família e diversão.,vez atendimento casa familia,Ja viemos outras vezes e sempre excelente com atendimento excelente. Casa muito boa para familia e diversao.,0,0_lugar_atendimento_aniversario_amigo,"['lugar', 'atendimento', 'aniversario', 'amigo', 'ambiente', 'funcionario', 'certeza', 'vez', 'familia', 'casa']","['lugar decoracao atendimento lugar amigo familia', 'atendimento garcons lugar amigo lugar aniversario', 'lugar atendimento aniversario amigo']",0.9876524209976196,0.008869044482707977,0.003478531027212739,0.9876524209976196,Positive,[]
4 de maio de 2019,"A casa e maravilhosa! Ambiente super agradável, atendimento top e comida muito boa.ja é a 4 vez que venho... Recomendo.",casa ambiente atendimento vez,"A casa e maravilhosa! Ambiente super agradavel, atendimento top e comida muito boa.ja e a 4 vez que venho... Recomendo.",0,0_lugar_atendimento_aniversario_amigo,"['lugar', 'atendimento', 'aniversario', 'amigo', 'ambiente', 'funcionario', 'certeza', 'vez', 'familia', 'casa']","['lugar decoracao atendimento lugar amigo familia', 'atendimento garcons lugar amigo lugar aniversario', 'lugar atendimento aniversario amigo']",0.9817849397659302,0.00957645382732153,0.008638585917651653,0.9817849397659302,Positive,[]
4 de maio de 2019,"Ótimo lugar, boa diversão! Top demais, super recomendo, vim no meu aniversário comemorar, e fiquei super satisfeito",lugar diversao aniversario,"Otimo lugar, boa diversao! Top demais, super recomendo, vim no meu aniversario comemorar, e fiquei super satisfeito",0,0_lugar_atendimento_aniversario_amigo,"['lugar', 'atendimento', 'aniversario', 'amigo', 'ambiente', 'funcionario', 'certeza', 'vez', 'familia', 'casa']","['lugar decoracao atendimento lugar amigo familia', 'atendimento garcons lugar amigo lugar aniversario', 'lugar atendimento aniversario amigo']",0.9787326455116272,0.00858972780406475,0.01267752330750227,0.9787326455116272,Positive,[]
